title,score,id,url,comms_num,created,body,timestamp
Health Canada approves AstraZeneca COVID-19 vaccine,7,lt74vw,https://www.canadaforums.ca/2021/02/health-canada-approves-astrazeneca.html,0,1614400425.0,,2021-02-27 06:33:45
COVID-19 in Canada: 'Vaccination passports' a near certainty says bio-ethicist,2,lsh0ij,https://www.canadaforums.ca/2021/02/covid-19-in-canada-vaccination.html,1,1614316267.0,,2021-02-26 07:11:07
Coronavirus variants could fuel Canada's third wave,6,lohlle,https://www.canadaforums.ca/2021/02/coronavirus-variants-could-fuel-canadas.html,0,1613886608.0,,2021-02-21 07:50:08
Canadian government to extend COVID-19 emergency benefits,1,lnptv8,https://www.canadaforums.ca/2021/02/canadian-government-to-extend-covid-19.html,0,1613795713.0,,2021-02-20 06:35:13
Canada: Pfizer is 'extremely committed' to meeting vaccine delivery targets,6,lkslm6,https://www.canadaforums.ca/2021/02/canada-pfizer-is-extremely-committed-to.html,0,1613468188.0,,2021-02-16 11:36:28
Canada: Oxford-AstraZeneca vaccine approval expected this week,5,lftbji,https://www.canadaforums.ca/2021/02/canada-oxford-astrazeneca-vaccine.html,0,1612869431.0,,2021-02-09 13:17:11
Comment,1,ej9x066,,0,1553474093.0,Your OP. It's not a myth. Only one vaccine contains it and you can get it without it. So your OP is pointless flex. ,2019-03-25 02:34:53
Fuck you anti-vaxxing retards,10,g6jkhp,https://www.reddit.com/r/VaccineMyths/comments/g6jkhp/fuck_you_antivaxxing_retards/,8,1587662622.0,https://youtu.be/zBkVCpbNnkU,2020-04-23 20:23:42
Comment,0,fofa0yy,,0,1587759590.0,Because Anti-Vaxxers have no sense,2020-04-24 23:19:50
Comment,0,ej9xuaf,,0,1553474721.0,"What do you mean by ""your OP"". I am fairly new to reddit.",2019-03-25 02:45:21
Comment,1,ej9x2qr,,0,1553474147.0,"When they say there's no thimerasol, they mean in the childhood schedule. That IS a fact. ",2019-03-25 02:35:47
Comment,2,ejacj98,,0,1553485820.0,"The ""myth"" you're debunking is in regards to the childhood schedule. ZERO OF THOSE VACCINES CONTAIN IT.  You're being a pedantic fuck for no reason. ",2019-03-25 05:50:20
Comment,2,ejabpdx,,0,1553485203.0,"You'll have to read it again because I didn't say that, the CDC did. You say one flu vaccine but the CDC says multiple. Check the CDC link. To paraphrase, ""It's out of most single dose and in most multi-dose."" That's more than one. I can't keep responding to people who won't even read what they're disagreeing with...",2019-03-25 05:40:03
Comment,3,ejaculv,,0,1553486050.0,"Nope. I didn't say anything about childhood vaccines in my OP. The myth, as I stated plainly, is ""Vaccines do not contain mercury."" They do contain mercury. Not all, but some, so the statement is incorrect.",2019-03-25 05:54:10
Comment,1,ejackaa,,0,1553485841.0,"I didn't say thimerosal is mercury. I said thimerosal contains mercury. You're not disagreeing with me. Again, I can't respond if you're not tracking the conversation. We won't get anywhere if you're not even willing to put your own shoes on...",2019-03-25 05:50:41
Comment,1,ejn2f7c,,0,1553870162.0,Doctors recommend vaccines for whatever you're most at risk for considering the area you live in. ,2019-03-29 16:36:02
Comment,1,ejn1jon,,0,1553868938.0,"I'm saying that even if you live away from people, you can still get diseases from plants / funghi. Things like Malaria, Dengue and JEV can be gotten from animals. 

And if you're on Reddit, you got some piece of technology. This is pretty silly. :P",2019-03-29 16:15:38
Comment,1,ejmzlio,,0,1553866351.0,"Kind of hard to avoid exposure unless you abandon being in contact with people completely - and even then, not all diseases that you can vaccinate against come from humans. 

It's not possible to (safely) avoid exposure.",2019-03-29 15:32:31
Comment,1,ejdklga,,0,1553584261.0,Herd immunity to me is a delegation of one's responsibility of his wellbeing to others. That's basically what it is; regardless if a drug works or not. And that's insanity at its finest point having someone to blame others for his immune being grounded. It's unbelievable.,2019-03-26 09:11:01
Comment,1,ejc4ys1,,0,1553549348.0,"I didn't admit there are. Two vaccines contain thimerasol. That is a compound and not an element. If you'd like, I'll start a GoFundMe to put you into a basic chemistry class so you understand the fucking difference. Jesus Christ, it's literally been like arguing with an anti-vaxxer. You cannot retain anything taught to you, no matter how many people explain it to you.",2019-03-25 23:29:08
Comment,1,ejc4rd0,,0,1553549174.0,"You finally admit there is mercury in vaccines. You arguing with yourself kid. I never said it's worrisome. I just said it's in there and that's a problem when doctors and TED talks are saying it's not. You seem to only be able to disagree with things I didn't say. 100% of my argument is that mercury is in vaccines, which you seem to suddenly agree with after spending an entire day saying the opposite. I'm gonna let go of your hand now. ✌️",2019-03-25 23:26:14
Comment,2,ejc48az,,0,1553548719.0,"Because it is an ethylmercury you monumental dumbass. Also, just because there is mercury in the compound doesn't mean it's unsafe. That's like saying table salt is dangerous because it contains sodium and chloride. We obviously don't worry about the elements that make up what goes on or in most of our foods, why are you making a fuss about thimerasol? Oh yeah, because you're an idiot. 

Also, your analogy is shit. You could go get 40 vaccines at once and still receive less ""mercury"" than you would eating fish, and fish contains methylmercury, which is actually harmful. 

Even if we humored your ridiculous idea that the mercury in thimerasol is actually worrisome, which it isn't because thimerasol still isn't mercury, you should worry more about literally everything else because of the minuscule amounts of it. The dose makes the poison and your liver and easily handle less than a mcg of ethylmercury.",2019-03-25 23:18:39
Comment,0,ejc2imz,,0,1553547167.0,"Good thing I didn't say thimerosal is mercury, but there is mercury, in the form of ethylmercury, in thimerosal. Jumping off a 5-story building is ""relatively safe"" compared to Jumping off a 10-story building. Why are you saying ""ethyl""? Would it make you look stupid to say ethylmercury? Yeah probably.",2019-03-25 22:52:47
Comment,1,ejb7724,,0,1553508491.0,"You can be anything on the internet and you choose to be an idiot. There is no mercury in vaccines. Never has been. Now, let's humor the idea and hey into your world where for some reason, it matters that thimerosal is 50% ethyl organomercury by weight.

There isn't even a microgram of thimerosal in the multi-dose flu shot, which is referred to as a ""trace amount."" Now, only half of that not even a mcg is actually ethyl organomercury. 

Your body, a result of billions of years of evolution, has an organ system whose sole purpose is to filter stuff out. Guess what? That incredibly tiny amount of ethyl organomercury is processed by this system extremely easily and is removed from the body. 

So, Dr. Dumbass, do you want to keep going on about the total NON-FUCKING-ISSUE of thimerosal and how it ISN'T FUCKING MERCURY, or do you want to continue to be a total idiot? 

Jesus fucking Christ, dude, you might as well be against vaccines because you sure as shit aren't for the truth.

Also, go get a flu shot and come back and tell me if there's a question on the form you filled out about being allergic to thimerosal. They don't exactly hide it. 1. It's an ingredient in a shot which has a thimerasol free version and 2. Unless your body personally has a problem with it, it's not harmful. 

Fuck. ",2019-03-25 12:08:11
Comment,1,ejasy5x,,0,1553497556.0,"Just ethylmercury, which is a form of this thing called mercury...",2019-03-25 09:05:56
Comment,2,ejarnxh,,0,1553496600.0,You just went full retard.,2019-03-25 08:50:00
Comment,1,ejaqwhg,,0,1553496049.0,"Not in my mind, but in the FDA's mind, ""Thimerosal is a mercury-containing organic compound.""
https://www.fda.gov/biologicsbloodvaccines/safetyavailability/vaccinesafety/ucm096228

But you are correct, chloride isn't one of the fucking ingredients of french fries, unless they're salted, in which case it is, because there is chloride in sodium-chloride.  That's why it's called sodium-chloride.  Bye now.",2019-03-25 08:40:49
Comment,2,ejao1av,,0,1553493953.0,"Think about this. When you eat french fries, chloride isn't one of the fucking ingredients. So why do vaccines that have thimerasol, in your mind, contain mercury?",2019-03-25 08:05:53
Comment,2,ejanygr,,0,1553493898.0,What's in table salt?,2019-03-25 08:04:58
Comment,3,ejai8qo,,0,1553489861.0,"I agree with the statement because it's true. That doesn't mean there is mercury in vaccines. Just stop. You lost as soon as you posted, and then decided to double, triple, and quadruple down on your idiocy.",2019-03-25 06:57:41
Comment,0,ejah7aa,,0,1553489130.0,"What is thimerosal? I know it's a compound, but what's in it? What's it made of?",2019-03-25 06:45:30
Comment,1,ejaglyf,,0,1553488704.0,"So you agree with the statement, ""Thimerosal is a mercury-containing organic compound.""?",2019-03-25 06:38:24
Comment,2,ejagid2,,0,1553488633.0,They're not lying! Your inability to grasp a simple concept makes me wonder how you breathe on your own. ,2019-03-25 06:37:13
Comment,0,ejagfa0,,0,1553488573.0,"I never once said I was concerned about thimerosal. But allot of people feel like they should be, in no small part because doctors and medical professionals are lying about it, to millions of people. If you want to encourage vaccine participation, that's bad isn't it?",2019-03-25 06:36:13
Comment,3,ejagcz8,,0,1553488527.0,"That's not how chemistry works, Dr. Dumbass. If this were the case, table salt would literally kill you upon ingesting. ",2019-03-25 06:35:27
Comment,2,ejag8w0,,0,1553488447.0,"Sodium explodes in water and chloride is a poisonous gas. So, tell me, why are you concerned about thimerasol?",2019-03-25 06:34:07
Comment,1,ejag1r5,,0,1553488306.0,"I have not disputed this. Elements (mercury) are in compounds (thimerosal). Thimerosal, a compound, contains mercury, an element.",2019-03-25 06:31:46
Comment,0,ejaftc8,,0,1553488143.0,Sodium and chloride.,2019-03-25 06:29:03
Comment,3,ejafaqc,,0,1553487787.0,True or false: Compounds are not elements.,2019-03-25 06:23:07
Comment,2,ejaf2ms,,0,1553487634.0,Please tell me what table salt is made of. ,2019-03-25 06:20:34
Comment,2,ejae7fj,,0,1553487019.0,"True or false- ""Thimerosal is a mercury-containing organic compound.""
???",2019-03-25 06:10:19
Comment,1,ejadvtu,,0,1553486786.0,"I sure am, which is how I know there is mercury in vaccines when doctors have told me and millions of others the opposite... I didn't post this intending to be educated. If you claim to have knowledge I don't, it only makes sense for me to ask what it is, and for you to explain it, especially if it's elementary. Why not just educate me? Wouldn't that be easier?",2019-03-25 06:06:26
Comment,2,ejadlyg,,0,1553486588.0,I've been studying and debating vaccine safety for years. You're just flat out wrong. ,2019-03-25 06:03:08
Comment,3,ejadjse,,0,1553486545.0,They don't contain mercury. Compounds are not elements. You're still wrong. Go take a chemistry class before you look like a dumbass again. ,2019-03-25 06:02:25
Comment,1,ejn5xrv,,0,1553875497.0,"Yes, that can be a few vaccinations. I've been vaccinated a number of times, personally. I travel a lot, so I get vaccinated more then most.",2019-03-29 18:04:57
Comment,1,ejpjkm0,,0,1553943184.0,Why are you deleting all your comments?,2019-03-30 12:53:04
Comment,1,ejy4sim,,0,1554242883.0,Lol,2019-04-03 01:08:03
Comment,1,ejpwlwu,,0,1553957825.0,Sorry to hear about that. ,2019-03-30 16:57:05
Comment,2,ejzgker,,0,1554275692.0,"You make a good point about natural infection antibodies being passed from mother to child. So if the child did contract measles, the body would recognize it & a lesser reaction would occur. 

Now that we're in the 3rd generation of lower quality vaccine immunity, children/adults contracting measles would have a more serious reaction. ",2019-04-03 10:14:52
Comment,1,ejz8glc,,0,1554269533.0,"See my comment above, this probably is a error on the part of the cdc, but isn't a reason not to vaccinate

Also, your link doesn't talk about the effects of measles, it just says MMR doesn't cause autism",2019-04-03 08:32:13
Comment,1,ejz85ic,,0,1554269313.0,"Good job catching this error, but note that the case-fatality rate may have gone up in recent decades due to the fact that most people are vaccinated, so a higher percentage of those who get measles may be immune-compromised, too young to be vaccinated (natural infection leads to immunity that are passed on to the child, but vaccination doesn't as much), or adults (who get worse measles)

Even so, way less people die of measles now than before the vaccine, because of the massive ( >20,000 fold) decrease in the number of people infected.",2019-04-03 08:28:33
Comment,4,ejyuv4g,,0,1554260683.0,"> neurobiologists ... lawyers

Oh, good, that's relevant.

",2019-04-03 06:04:43
Comment,8,ejytxj4,,0,1554260092.0,">The 1 in 1000 fatality rate from measles is a known calculation error by the CDC.

Nah.

>It's actually closer to 1 in 10,000 or 0.01% of cases.

It's actually closer to 0% in areas where it's been eliminated, due to vaccination.

There's also a whole host of terrible sequalae associated with the virus. And the known fact that anyone framing a situation as ""the only thing you should care about is the rate at which you will literally die"" is a complete asshat.

https://www.ncbi.nlm.nih.gov/pmc/articles/PMC2908388/",2019-04-03 05:54:52
Comment,1,ejyekic,,0,1554249972.0,Try [again](https://vaxopedia.org/2018/01/15/measles-propaganda-from-the-physicians-for-informed-consent/).,2019-04-03 03:06:12
Comment,1,ejyd6qo,,0,1554248995.0,"Similar things can also be said about small groups of scientists who don't believe in evolution, or deny climate change.  They're all still quacks.",2019-04-03 02:49:55
Comment,3,ejyawnq,,0,1554247392.0,"Who can't tell the difference between aluminium and aluminium hydroxide. Get outta here with those dumb ""references"". Wouldn't trust them to even properly take my pulse. ",2019-04-03 02:23:12
Comment,-6,ejy5w08,,0,1554243731.0,"Physicians for Informed Consent is a group of board certified medical doctors, neurobiologists, immunologists, nurses & lawyers. Members have also testified in front of Congress regarding vaccine safety. I don't see how that's a conspiracy ",2019-04-03 01:22:11
Comment,1,ejzjlqf,,0,1554278117.0,">Now that we're in the 3rd generation of lower quality vaccine immunity, children/adults contracting measles would have a more serious reaction.

Note that although now measles may be more serious for the who do get it, the chance of getting it at all now is lower than the chance of *dying* from measles before the vaccine, so this is not an argument against vaccination

&#x200B;",2019-04-03 10:55:17
Comment,-1,ejzsq7u,,0,1554285345.0,"And you're still wrong--it's not an error. The estimate is actually 1-2 per 1000 which derived from surveillance data collected throughout the 1985-1992 measles resurgence. 
Read [that](https://www.annualreviews.org/doi/abs/10.1146/annurev.me.43.020192.002315) and then get back to me. Also, to state the obvious, you're conflating *estimated* cases with *reported* deaths, aka apples to oranges. As an aside, it is fun to note your wording stance change from ""Known calculation error"" to ""probably an error"". 

Finally, my link does not ""just"" say MMR doesn't cause autism. It's a chestnut for standard anti-vaxxer nonsense. For measles sequelae you can read any of the dozen CDC articles for laypeople or you can check [this](https://www.ncbi.nlm.nih.gov/m/pubmed/22889539/) for just CNS sequelae, if you're feeling frisky.

You should probably stick to reputable sources, such as the CDC. ",2019-04-03 12:55:45
Comment,1,ejzuye6,,0,1554287124.0,"I meant it was an error to say the death rate was 1 in 1,000 before the vaccine, note that in my other comment[https://www.reddit.com/r/VaccineMyths/comments/b8jhk7/myth\_1\_in\_1000\_measles\_cases\_are\_fatal/ejz85ic?utm\_source=share&utm\_medium=web2x](https://www.reddit.com/r/VaccineMyths/comments/b8jhk7/myth_1_in_1000_measles_cases_are_fatal/ejz85ic?utm_source=share&utm_medium=web2x) I said the case-fatality rate may be going up as the number of cased dropped due to vaccination, so I am not challenging the estimate that it was 1 in 1,000 in 1985-1992 (more recent data actually shows 1 in 250)

>Finally, my link does not ""just"" say MMR doesn't cause autism.

What does it say then? I didn't see anything about neurological sequelae in that article, but I do know they exist.

>It's a chestnut for standard anti-vaxxer nonsense.

Did you miss ""but isn't a reason not to vaccinate""? Also note that in the comment I linked I also say the vaccine has reduced deaths

>As an aside, it is fun to note your wording stance change from ""Known calculation error"" to ""probably an error"".

I wasn't the one who said ""Known calculation error"", but even if I was, arguing semantic details is pointless

>You should probably stick to reputable sources, such as the CDC

I am not OP, all my info is coming from the CDC",2019-04-03 13:25:24
Comment,1,ek0lcq0,,0,1554321260.0,"> I meant it was an error to say the death rate was 1 in 1,000 before the vaccine

I understand you're saying that. I don't believe it.

>I said the case-fatality rate may be going up as the number of cased dropped due to vaccination

Which would be an interesting hypothesis considering the apparent mortality rate hasn't changed from pre-1963 to recent outbreaks. I don't see much support for it from where I'm standing.

>(more recent data actually shows 1 in 250)

That could be something.

>What does it say then?

If you're curious, read it.

>Did you miss ""but isn't a reason not to vaccinate""? Also note that in the comment I linked I also say the vaccine has reduced deaths

No. It's still a good resource. 

>I wasn't the one who said ""Known calculation error"", but even if I was, arguing semantic details is pointless

It's not arguing semantics. And in any case, you'd be saying it's ""probably an error"" which is unsubstantiated.

>I am not OP, all my info is coming from the CDC

Ah, I see that now.



",2019-04-03 22:54:20
Comment,3,ek0a3jp,,0,1554303456.0,"Measles has never been eliminated. There have been cases every year since the introduction of the vaccine. Numbers vary by year. In 1982, there were 1,697 reported cases of measles in the US and public health officials stated that elimination was around the corner. Then a resurgence occurred between 1989-1991 with over 53,000 cases.  As a result of this increase, children were required to get a second dose of the vaccine. 

In the year 2000, when the US declared it ""eradicated,"" there were still 86 cases of measles. 

Then take into account vaccine strain virus shedding after MMR. Reports of throat, blood, and urine samples all testing positive for vaccine strain measles infection up to 5 weeks from vaccination. 

[Vaccine associated measles 5 weeks post vaccine](https://www.eurosurveillance.org/content/10.2807/1560-7917.ES2013.18.49.20649)

[Measles in Throat of Vaccinated Child](https://www.sciencedirect.com/science/article/pii/S0264410X01004959)

[Excretion of Vaccine Strain Measles virus](https://www.eurosurveillance.org/content/10.2807/ese.15.35.19652-en)

During the 2015 California measles outbreak, many suspected cases actually occurred in persons who were recently vaccinated. 194 measles virus sequences were collected in 2015, with 73 cases found to have actually been vaccine strain measles. 

2011 New York, report of 88 person measles outbreak started by a twice-vaccinated individual. 

[Measles Mary](https://academic.oup.com/cid/article/58/9/1205/2895266)

Can measles truly be eliminated if the live virus continues to be injected into the population with vaccines?

&#x200B;

And since you sent me a study discussing MMR, thimerosal and autism. Here's a link to a hidden CDC study of vaccinated vs unvaccinated. It compares children receiving the thimerosal containing Hepatitis B vaccine during the first month of life. The results of this study were never released by the CDC and an abstract was only obtained under FOIA request. 

Children vaccinated with Hepatitis B vaccine in the first month of life compared to children receiving no vaccines in the first month of life had an increased risk of 762% for autism, 829% for ADHD, 638% for ADD, 565% for tics, 498% for sleep disorders, and 206% for speech delays.

[CDC unpublished vax vs unvax study](https://vaccine-safety.s3.amazonaws.com/CDC_FOIA_Response_UnpublishedStudy.pdf)

&#x200B;

&#x200B;

&#x200B;

&#x200B;",2019-04-03 17:57:36
Comment,2,ek0or1b,,0,1554324545.0,"> Measles has never been eliminated.

The Americas were declared measles free back in 2016. I'm guessing you confused 'locally eliminated' with 'globally eradicated'.

>There have been cases every year since the introduction of the vaccine.

You mean since the virus has existed?

>Then take into account vaccine strain virus shedding after MMR. Reports of throat, blood, and urine samples all testing positive for vaccine strain measles infection up to 5 weeks from vaccination.

Vaccine strain isn't the same as the pathogenic strain. This isn't scary for anyone except those undergoing chemotherapy and other immune-depleting situations.

>During the 2015 California measles outbreak, many suspected cases actually occurred in persons who were recently vaccinated.

[Wrong](https://www.cdc.gov/mmwr/preview/mmwrhtml/mm6406a5.htm?s_cid=mm6406a5_w):

>>Among the 110 California patients, 49 (45%) were unvaccinated; five (5%) had 1 dose of measles-containing vaccine, seven (6%) had 2 doses, one (1%) had 3 doses, 47 (43%) had unknown or undocumented vaccination status, and one (1%) had immunoglobulin G seropositivity documented, which indicates prior vaccination or measles infection at an undetermined time.

Which is entirely consistent with vaccination efficacy.

>194 measles virus sequences were collected in 2015, with 73 cases found to have actually been vaccine strain measles.

Wrong again:

>>The source of the initial Disney theme park exposure has not been identified. Specimens from 30 California patients were genotyped; all were measles genotype B3, which has caused a large outbreak recently in the Philippines, but has also been detected in at least 14 countries and at least six U.S. states in the last 6 months (1).

Vaccine strain is not capable of causing wild-type disease.

>2011 New York, report of 88 person measles outbreak started by a twice-vaccinated individual.

Wow, let's hope this isn't a common occurrence. From your source:

>>**This is the first report** of measles transmission from a twice-vaccinated individual with documented secondary vaccine failure.

Impressive. You've convinced me fully. We should stop vaccinating.

>Can measles truly be eliminated if the live virus continues to be injected into the population with vaccines?

Yep. Happened with smallpox, and from entire hemispheres with polio and measles. Did you forget that?

>And since you sent me a study discussing MMR, thimerosal and autism.

You didn't read it. You should read it.

>The results of this study were never released by the CDC and an abstract was only obtained under FOIA request.

Wait...you mean *this* unpublished study???

http://pediatrics.aappublications.org/content/112/5/1039.full.pdf

You'd apparently believe any bold-faced lie a fellow anti-vaxxer told you. Truly hot on the case!",2019-04-03 23:49:05
Comment,1,ek0ul3u,,0,1554329201.0," Here is an explanation of how I calculated the measles death rate (including the 1 in 250 estimate) [https://vaxfact.fandom.com/wiki/4](https://vaxfact.fandom.com/wiki/4)

>If you're curious, read it

Okay, it says that MMR, thimerosal, and ""too many vaccines"" don't cause autism, but no one ever said anything about autism, so I still don't know why you brought this up",2019-04-04 01:06:41
