title,score,id,url,comms_num,created,body,timestamp
The most disgusting anti-vaxxer I've probably encountered to date.,19,3c4zaa,http://imgur.com/gallery/F1qgmrU,1,1436043674.0,,2015-07-05 00:01:14
"No matter what side of the debate you are on, is anyone else bothered by the language being used over the current mandatory vaccination controversy?",0,3bw90w,https://www.reddit.com/r/VaccineMyths/comments/3bw90w/no_matter_what_side_of_the_debate_you_are_on_is/,3,1435859203.0,"The fact that human society is continually being referred to in the media as a ""herd,"" as though we were just a bunch of animals, is, at the base level, ominous.",2015-07-02 20:46:43
"I have an autistic child. Don't know what caused it, but you saying that if indeed vaccines do cause it, it is an exceptable risk... Makes me want to kick you right in your filthy cunt.",4,3bedxo,http://www.np.reddit.com/r/conspiracy/comments/3bcvcm/publisher_of_controversial_autism_research_dr/csl9kox,3,1435497218.0,,2015-06-28 16:13:38
"The annals of “I’m not antivaccine,” part 18: Dr. Bob goes full Godwin over SB 277",3,3a6xxy,http://scienceblogs.com/insolence/2015/06/17/the-annals-of-im-not-antivaccine-part-18-dr-bob-goes-full-godwin-over-sb-277/#.VYG9h88PA1c.reddit,1,1434566063.0,,2015-06-17 21:34:23
Cervical cancer vaccine 'Gardasil' being deemed the largest scam in medical history,9,355iuq,http://www.cbsnews.com/news/gardasil-researcher-speaks-out/,3,1430984593.0,,2015-05-07 10:43:13
I Got 99 Problems But A Brain Ain't One,4,34lqmx,http://www.np.reddit.com/r/hiphopheads/comments/34lgwh/the_vaccine_song_say_no_to_the_vaccine_by_trillion/,1,1430552066.0,,2015-05-02 10:34:26
Jenny McCarthy in a Nutshell,3,32zf46,https://youtu.be/MNwsj6wbxZM,2,1429317330.0,,2015-04-18 03:35:30
Vote delayed on California bill seeking to toughen vaccine mandate,11,32rj6h,http://www.latimes.com/local/political/la-me-pc-senate-panel-toughen-mandate-vaccinating-children-20150415-story.html,2,1429154256.0,,2015-04-16 06:17:36
"Gardasil ""Removed"" from Japanese market (even though it wasn't ""removed"" at all)",7,32oo5h,http://www.tokyotimes.com/side-effects-in-young-girls-take-gardasil-out-from-japanese-market/,2,1429106427.0,,2015-04-15 17:00:27
How Anti-Vaxxers Sound to Normal People,17,32i5bl,https://www.youtube.com/watch?v=B_hCLWtEHL8,1,1428969540.0,,2015-04-14 02:59:00
"""Mom asks CDC some questions..."" A sophomoric attempt to be a hero by a vaccine denier: an analysis",2,31dtwr,http://imgur.com/9WlxXXC,4,1428116698.0,,2015-04-04 06:04:58
"Naturalpath ""Dr"" Glidden tries desperately to discredit vaccines. Uses a lot of pseudo-science and shameless promotes his own profits in trying to do so. [x-post from /r/truthaboutvaccines]",10,30poea,http://www.np.reddit.com/r/conspiracy/comments/30hz38/dr_peter_glidden_destroys_the_myths_surrounding/,4,1427648127.0,,2015-03-29 19:55:27
"So, how is the vaccinated kid going to die from a disease the unvaccinated kid has? And if two unvaccinated kids have a disease and one dies, how can you prove original carrier? Shedding and symptoms may not be concurrent.",6,30h0xq,https://np.reddit.com/r/politics/comments/2tkxnp/would_you_support_a_law_holding_antivax_parents/co02mqq?context=3,1,1427445093.0,,2015-03-27 10:31:33
RFK JR going derp,7,2zdcf7,http://www.twitter.com/RobertKennedyJr/status/531912864555347968,2,1426612918.0,,2015-03-17 19:21:58
Italian Court Reignites MMR Vaccine Debate After Award Over Child with Autism,6,2y6x0o,http://articles.mercola.com/sites/articles/archive/2012/06/25/mmr-vaccine-caused-autism.aspx,2,1425686974.0,,2015-03-07 02:09:34
"In my case I have investigated vaccine technology and found it to be a crime against humanity in how they are currently used. Certainly they are one of the principal causes of autism, and are undoubtedly linked to a host of other emerging disorders.",3,2y3ts4,http://www.np.reddit.com/r/conspiracy/comments/2xoakb/jimmy_kimmels_ignorant_vaccine_doctors_i_work_for/cp2cmxk?context=1,1,1425616893.0,,2015-03-06 06:41:33
"This PowerPoint is my attempt at a public resource for exhaustively addressing antivax claims. This will remain a work in progress, to be updated to follow emerging popular claims. Suggestions are encouraged. Please read and share",6,2xhkll,http://www.authorstream.com/Presentation/izzythedrumist-2410156-scientific-literature-vaccinations/,1,1425152281.0,,2015-02-28 21:38:01
"I'm interested in discussing the vaccine aspect of this documentary and the arguments presented within. Note, It's only available for the next six days for free.",5,2xfg1c,http://boughtmovie.net/free-viewing/,20,1425094824.0,,2015-02-28 05:40:24
"Antivax mom makes concentration camp-style badge to protest her ""persecution""",16,2wusj5,http://imgur.com/gallery/uvp7Uya/new,1,1424681615.0,,2015-02-23 10:53:35
Lifting The Lid On The Vaccination Debate: Why We Deserve To Hear Both Sides Of The Argument,2,2wcqpb,http://www.trueactivist.com/lifting-the-lid-on-the-vaccination-debate-why-we-deserve-to-hear-both-sides-of-the-argument1/?utm_source=feedburner&utm_medium=feed&utm_campaign=Feed%3A+TrueActivist+%28True+Activist%29,3,1424293397.0,,2015-02-18 23:03:17
Basically just a bunch of bullshit talking points dreamed up by vaccine propagandists to scare you into using their products and push the public debate toward mandatory vaccination for any and every disease they think they can make a buck on.,7,2w5zbh,http://www.np.reddit.com/r/conspiracy/comments/2w1fif/hey_look_more_vaccine_propaganda_on_the_front/comuxot?context=2,1,1424152310.0,,2015-02-17 07:51:50
Fake Disney Outbreak post debunked,5,2w5nhr,http://www.np.reddit.com/r/conspiracy/comments/2w32u2/fake_disney_measles_outbreak_send_in_the_clowns/,2,1424145514.0,,2015-02-17 05:58:34
"I'm not scared of measles, even the atypical form. I'll take my chances with measles or polio or whatever, but NOT vaccines.",4,2w3zij,http://www.np.reddit.com/r/conspiracy/comments/2w32u2/fake_disney_measles_outbreak_send_in_the_clowns/con6yz4,2,1424117155.0,,2015-02-16 22:05:55
Ottawa daycare is promising a ‘vaccine-free environment’ for kids.,7,2vyg07,http://news.nationalpost.com/2015/02/09/ottawa-daycare-promises-vaccine-free-environment-for-kids-public-health-is-not-happy-about-it/,4,1423988361.0,,2015-02-15 10:19:21
"From /r/conspiracy - a post linking to the package insert for the MMR vaccine, but everything is being taken way out of context - my post corrects it.",5,2vxwha,http://www.np.reddit.com/r/conspiracy/comments/2vv7cx/from_the_insert_of_mmr_vacine/,4,1423972783.0,,2015-02-15 05:59:43
www.antivaxxvalentines.com,7,2vu3b1,http://40.media.tumblr.com/054404a698c9621882222ca8fc5eb4aa/tumblr_njmau3WeVV1unzj07o1_r1_1280.jpg,1,1423881432.0,,2015-02-14 04:37:12
"More from Antivax book ""Dissolving Illusions"" review comments: ""INJECTED through a vaccine ... neurotoxins get taken up through our lymphatic system where immune cells carry them into the brain.""",5,2vscbq,http://www.amazon.com/review/R1C1ZYX11ON8TA/ref=cm_cr_rev_detmd_pl?ie=UTF8&asin=1480216895&cdForum=Fx28U0CZVZDOVBB&cdMsgID=Mx33Y23CUHCSPPL&cdMsgNo=75&cdPage=8&cdSort=oldest&cdThread=Tx3IADG8MGYXGLQ&store=books#Mx33Y23CUHCSPPL,2,1423850098.0,,2015-02-13 19:54:58
The measles virons only live outside the body for a short period of time (about two hours). Close Disney World for one day.,5,2vg5dl,http://www.np.reddit.com/r/conspiracy/comments/2vd2nh/one_thing_i_find_disturbing_about_vaccination/cogpy2n,5,1423596350.0,,2015-02-10 21:25:50
Melanie's Marvelous Measles,5,2v2cke,http://www.amazon.com/Melanies-Marvelous-Measles-Stephanie-Messenger/dp/1466938897/,2,1423285427.0,,2015-02-07 07:03:47
Measles vaccination urged amid Disneyland outbreak,5,2twflb,http://www.scientificamerican.com/article/measles-vaccinations-urged-amid-disneyland-outbreak/?WT.mc_id=SA_HLTH_20150127,1,1422402157.0,,2015-01-28 01:42:37
The past and present rebuke antivaccinationists who claim measles is “benign”,3,2thyu1,http://scienceblogs.com/insolence/2015/01/22/the-past-and-present-rebuke-antivaccinationists-who-claim-measles-is-benign/?utm_source=widgets,2,1422088961.0,,2015-01-24 10:42:41
"Last Year’s Flu Vaccine Killed and Injured Over 93,000 US Citizens – Will This Year be Any Different?",3,2thk3z,http://www.thelibertybeacon.com/2014/11/11/last-years-flu-vaccine-killed-and-injured-over-93000-us-citizens-will-this-year-be-any-different/,4,1422076811.0,,2015-01-24 07:20:11
Vaccinations Made My Cat Autistic,14,2tfmeq,http://reductress.com/post/vaccinations-made-my-cat-autistic/,2,1422041358.0,,2015-01-23 21:29:18
Why We Didn’t Vaccinate Our Child,12,2tcmr6,http://nightofthelivingdad.net/2014/08/13/why-we-didnt-vaccinate-our-child/,5,1421973626.0,,2015-01-23 02:40:26
"I'm not a crazy, 43 year old mom with nothing better to do than to campaign against a lost cause. I'm 18, from the UK, and whilst Dr Wakefield is my godfather's brother, I don't feel biased towards him.",7,2t5e5b,http://www.np.reddit.com/r/todayilearned/comments/2t2yij/til_the_doctor_who_claimed_that_there_was_a_link/cnvg3yy,7,1421824962.0,,2015-01-21 09:22:42
"Are courts in the business of handing out 6 and 7 figure payouts to anyone claiming damages from vaccines? Is this like one of the world's best kept secrets? Also, is the tooth fairy real?",2,2t5dxf,http://www.np.reddit.com/r/conspiracy/comments/2t3wd5/1_post_on_front_page_from_rtodayilearned_allows/cnvlg0s,2,1421824801.0,,2015-01-21 09:20:01
Tim Burtons 'Batman' clearly is the proof vaccines cause autism,7,2t5dq7,http://www.np.reddit.com/r/conspiracy/comments/2t4r5h/doctor_behind_vaccineautism_link_loses_license/cnvp7w6,3,1421824642.0,,2015-01-21 09:17:22
"Not sure what condition you have, but many conditions that leave you with a compromised immune system can be passed down to your kids, so it might be better to adopt even if you weren't sterile.",2,2t5ddc,http://www.np.reddit.com/r/news/comments/2t33vj/24_unvaccinated_students_banned_from_oc_high/cnvmmvn,1,1421824363.0,,2015-01-21 09:12:43
"Hmmm, so if people are vaccinated then why the fear of the unVaccinated? Who cares if they spread it amongst themselves and as far as compromised immune systems are concerned should they be around kids who are cesspool of virus and diesese regardless if vaccinated or not?",2,2t5db3,http://www.np.reddit.com/r/news/comments/2t33vj/24_unvaccinated_students_banned_from_oc_high/cnv9hs4,1,1421824304.0,,2015-01-21 09:11:44
Anti-Vaccine Body Count,8,2t1md2,http://www.jennymccarthybodycount.com/Anti-Vaccine_Body_Count/Home.html,1,1421756875.0,,2015-01-20 14:27:55
Computer programmer gets it wrong about the Amish and vaccinations.,4,2s793i,http://www.np.reddit.com/r/Health/comments/2s216h/chart_heres_the_rise_in_personal_belief/cnmdqm7,2,1421094468.0,,2015-01-12 22:27:48
University of PiktoChart: Vaccines Don't Work,6,2rqx42,https://magic.piktochart.com/output/4043568-vaccines-dont-work-here-are-th,3,1420729269.0,,2015-01-08 17:01:09
The people who signed this petition....,5,2qui17,https://www.change.org/p/lewis-r-first-editor-in-chief-publicly-issue-a-retraction-of-the-fraudulent-2004-mmr-autism-study?share_id=IrJihwRkUn&utm_campaign=autopublish&utm_medium=facebook&utm_source=share_petition,2,1419970995.0,,2014-12-30 22:23:15
I wonder if that correlates with glyphosate too. Another more scary theory I have is that autism is caused by vaccines they use as a form of eugenics in order to produce genius children at the cost of causing a lot of autism.,5,2qegwt,http://www.np.reddit.com/r/conspiracy/comments/2qdj81/mit_researcher_finds_99_correlation_between_the/cn5am2a,1,1419551325.0,,2014-12-26 01:48:45
"Antivax book ""Dissolving Illusions"" - 2 negative reviews and 88 consecutive perfect reviews.",4,2pt5ee,http://amzn.com/1480216895,4,1419013805.0,,2014-12-19 20:30:05
Which graph do you believe? Left? Right? Both? I'm interested in discussing the credibility of these two sources and interpreting what these graphs are telling us.,4,2ow0jc,http://imgur.com/ZhfXhxt,17,1418237542.0,,2014-12-10 20:52:22
Only Vaccinated Students Affected By Whooping Cough Outbreak In Massachusetts...,0,2osew5,http://www.naturalnews.com/047930_whooping_cough_vaccinations_exemptions.html#,19,1418156600.0,,2014-12-09 22:23:20
"There have been more than 200 cases of polio in Pakistan since January. ""Many people here think the polio vaccination campaign is a western conspiracy to sterilise their children - it's an idea the Taliban have been putting about for 10 years now.""",8,2nkr5i,http://www.bbc.com/news/magazine-30133279,4,1417094408.0,,2014-11-27 15:20:08
"Why I chose to delay vaccines with my first, and why I won't do that again",7,2nf9kj,http://wildhomestead.org/2014/11/25/why-i-chose-to-delay-vaccines-with-my-first-and-why-i-wont-do-that-again/,2,1416958305.0,,2014-11-26 01:31:45
"Mercola is a hero, he dares to fight TPTB, it's surprising he hasn't been assassinated yet. He's an individual who truly cares about health",2,2mub28,http://www.np.reddit.com/r/conspiracy/comments/2msro8/monsantos_roundup_and_glyphosate_toxicity/cm7gtp8,2,1416454104.0,,2014-11-20 05:28:24
it's now been admitted by a CDC whistleblower that they've been covering up the data which shows vaccines are causing Autism. Mercola recommends products which are far safer and more likely to be effective than anything that comes out of Big Pharma.,9,2mu29k,http://www.np.reddit.com/r/conspiracy/comments/2msro8/monsantos_roundup_and_glyphosate_toxicity/cm7hbkn,6,1416449400.0,,2014-11-20 04:10:00
"The concept of herd immunity (protection for the population) is often used by vaccine addicts as a way to push guilt at people who don’t line up, with their children, like robots for their shots.",2,2maqdr,http://www.np.reddit.com/r/conspiracy/comments/2manhq/vaccines_and_herd_immunity_nonsense/,10,1415984086.0,,2014-11-14 18:54:46
Hepatitis B vaccine kills three newborn babies with anaphylactic shock - Anti Vaxxer Woo from SeattleOrganicRestaurants.com,4,2lyvfe,http://www.seattleorganicrestaurants.com/vegan-whole-food/infant-deaths-hepatitis-b-vaccines.php,4,1415716997.0,,2014-11-11 16:43:17
"If the government was really covering up ""The truth"" about vaccines, and someone blew the whistle, how would we know if he was telling the truth?",0,2lls6t,https://www.reddit.com/r/VaccineMyths/comments/2lls6t/if_the_government_was_really_covering_up_the/,1,1415387317.0,,2014-11-07 21:08:37
Supposed research papers linking vaccines and autism. Anyone seen these before?,3,2ll62f,https://www.reddit.com/r/VaccineMyths/comments/2ll62f/supposed_research_papers_linking_vaccines_and/,4,1415375721.0,"My anti-vax aunt just posted [this list](http://www.scribd.com/doc/220807175/86-Research-Papers-Supporting-the-Vaccine-Autism-Link).

 Has anyone seen this before? It seems pretty fishy, especially given that it only consists of the abstracts for these supposed papers.",2014-11-07 17:55:21
"""Being Anti Vax is just like the fight for Civil Rights"" - White Girl",13,2l68hu,http://www.np.reddit.com/r/GMOMyths/comments/2l5y2w/real_studies_prove_gmos_are_highly_doused_in/clrszoc,5,1415035338.0,,2014-11-03 19:22:18
Ebola Can Be Prevented and Treated Naturally-so Why Are These Approaches Completely Ignored?,4,2korl8,http://www.organicconsumers.org/articles/article_31244.cfm,1,1414599914.0,,2014-10-29 18:25:14
Mucus,10,2ko787,http://i.imgur.com/TR7YV3A.jpg,16,1414588445.0,,2014-10-29 15:14:05
I would rather have any vaccine preventable illness than run the risk of getting an autoimmune disease from a vaccine.,4,2kfwxc,http://np.reddit.com/r/conspiracy/comments/2kann3/cdc_whistleblower_also_a_player_in_the/clk4l9b,1,1414390469.0,,2014-10-27 08:14:29
"""A foolish faith in authority is the worst enemy of truth."" - an ironic quote from a woo website",3,2k6pho,http://www.vaccination.inoz.com,1,1414148343.0,,2014-10-24 13:59:03
Check out r/HealthySkepticism a subreddit for the discussion of all kinds of medical myths,4,2iqixu,http://np.reddit.com/r/HealthySkepticism/,1,1412834261.0,,2014-10-09 08:57:41
Rob Schneider's Anti-Vaccine State Farm Ad !!,2,2i4lm3,https://www.youtube.com/watch?v=QHzVXvD8FeY&feature=youtu.be,3,1412283884.0,,2014-10-03 00:04:44
Rob Schneider Has Guts and Intelligence,3,2i2p9g,http://np.reddit.com/r/conspiracy/comments/2hpbw5/the_censoring_of_rob_schneider_schneider_gets/,6,1412238950.0,,2014-10-02 11:35:50
Wealthy L.A. Schools' Vaccination Rates Are as Low as South Sudan's,14,2gog85,http://www.theatlantic.com/health/archive/2014/09/wealthy-la-schools-vaccination-rates-are-as-low-as-south-sudans/380252/,4,1410975737.0,,2014-09-17 20:42:17
New subreddit: /r/conspirawhiners,2,2fxinj,https://www.reddit.com/r/VaccineMyths/comments/2fxinj/new_subreddit_rconspirawhiners/,2,1410288212.0,There is a new subreddit for calling out conspiracy theorists and their lies.  It's /r/conspirawhiners.,2014-09-09 21:43:32
MSM Buries CDC Scientist’s Confession About Vaccines & Autism Link,1,2ewn3m,http://www.youtube.com/attribution_link?a=AUb6ucF9uZ4&u=%2Fwatch%3Fv%3DriX1eiXgpNw%26feature%3Dshare,2,1409306762.0,,2014-08-29 13:06:02
"The Conspiracy is Falling Apart! Autism Vaccine Link Exposed by World Renowned Expert in Diseases, Vaccines and Child Development.....(wait for it).... ROB SCHNEIDER",15,2ei5sm,http://www.canaryparty.org/index.php?option=com_content&view=article&id=149:rob-schneider-demands-answers-on-cdc-mmr-fraud&catid=1:latest-news&Itemid=50,2,1408942047.0,,2014-08-25 07:47:27
Today I can report that I now have in my possession CDC documents which prove beyond any doubt that the former head of the CDC actively participated in willful scientific fraud in order to bury clinical evidence linking the MMR vaccine to a 340% increase in autism among African-American children.,3,2e97ms,http://www.naturalnews.com/046537_vaccine_violence_black_Americans_scientific_fraud.html,6,1408688363.0,,2014-08-22 09:19:23
"C is 3rd letter of the alphabet; 6th letter is F. 18 is what they equal multiplied: R is the 18th letter. Council the verb in German is rat. Noun: der rat. Lucifer comes to mind, personally.",1,2dlzr4,http://www.np.reddit.com/r/conspiracy/comments/2dg147/flashback_cfr_recording_suggests_creating_false/,1,1408079850.0,,2014-08-15 08:17:30
I can't believe how many anti-science people like you there are on Reddit,7,2dlzhz,http://www.np.reddit.com/r/offbeat/comments/2dadmz/high_school_students_make_a_scientifically/cjoh3kz,5,1408079655.0,,2014-08-15 08:14:15
And now this.,4,2btiel,http://youtu.be/g48CfiCHLWo,4,1406419353.0,,2014-07-27 03:02:33
See?!?!,12,2afwz7,http://i.imgur.com/uZC5fF9.gif,3,1405099603.0,,2014-07-11 20:26:43
Immunity,19,29tdec,http://i.imgur.com/E8C1nqi.jpg,3,1404466265.0,,2014-07-04 12:31:05
"Conspiratard claims recent study of vaccine safety was paid for by ""big pharma."" Study itself makes no indication of who paid for it. [X-post from /r/conspiratard]",4,29r0u2,http://www.np.reddit.com/r/conspiracy/comments/29qrd7/bigpharma_vaccines_deemed_safe_by_bigpharma/,2,1404403901.0,,2014-07-03 19:11:41
A review by one graduate student at Harvard is evidence that the flu isn't as deadly as the CDC says it is,1,2922qs,https://www.reddit.com/r/VaccineMyths/comments/2922qs/a_review_by_one_graduate_student_at_harvard_is/,3,1403704810.0,http://www.np.reddit.com/r/conspiracy/comments/28vj90/only_18_confirmed_us_flu_deaths_in_2001_not_36000/,2014-06-25 17:00:10
"So, I have to inject my kid with a low dose of a disease 'vaccinated' or they can't go to school. That's total bullshit............. ; (",10,2920wo,http://np.reddit.com/r/worldnews/comments/29148b/court_ruling_parents_dont_have_the_right_to_send/ciggoqg,1,1403703519.0,,2014-06-25 16:38:39
Hysterical!!! Conspiracy theorists fall for a SATIRICAL medical blog!,7,28kqqr,http://www.np.reddit.com/r/conspiracy/comments/28k2ou/it_seems_like_the_cdc_is_going_to_require/,4,1403204785.0,,2014-06-19 22:06:25
Anti-vaxxer claims to know topic inside and out and that doctors ask her opinion,3,28jzr1,http://www.np.reddit.com/r/conspiracy/comments/28dcro/how_you_can_tell_if_youre_posting_a_hot_topic_to/cib3mbt,2,1403189564.0,,2014-06-19 17:52:44
Activist posting stating that 85% of those contracting measles are fully vaccinated.,14,28aabs,http://www.np.reddit.com/r/conspiracy/comments/28a8ff/california_measles_85_of_those_contracting_it_are/,4,1402932300.0,,2014-06-16 18:25:00
Parent calls on /r/conspiracy to aid in harming his/her child by providing antivaccine information,15,27rc2u,http://www.np.reddit.com/r/conspiracy/comments/27p8ky/please_assist_i_need_everything_you_know_on_the/,2,1402372548.0,,2014-06-10 06:55:48
"""It's sad to think parents are still poisoning their children with vaccines"" Non-cited, non-researched, scare-tactic poster",8,279d2c,http://www.np.reddit.com/r/conspiracy/comments/2797tm/its_sad_to_think_parents_are_still_poisoning/,3,1401850102.0,,2014-06-04 05:48:22
"""Measles is like chicken pox, not a big deal.""",9,272fgl,http://www.np.reddit.com/r/Health/comments/26zsfi/measles_cases_in_the_us_reach_20year_high/chwbwrx,2,1401665755.0,,2014-06-02 02:35:55
(UN)convincing paper (tries) to provide proof that the myth of immune overload is not a myth.,2,271xgx,http://www.np.reddit.com/r/conspiracy/comments/2718bh/new_paper_provides_convincing_evidence_vaccine/,6,1401653596.0,,2014-06-01 23:13:16
Supposed link between vaccines and Diabetes/Autoimmune disorders?,2,26yzs2,http://www.vaccines.net/vaccine-induced-immune-overload.pdf,4,1401559931.0,,2014-05-31 21:12:11
"Mercury causes autism, no matter what anyone says. This youtube video is definitive proof!",11,26pft5,http://www.np.reddit.com/r/conspiracy/comments/26m39l/how_mercury_triggered_the_age_of_autism/chsmjmt?context=3,1,1401294217.0,,2014-05-28 19:23:37
"""Big pharma shill, Dr. Goldman, wants to tattoo a yellow star on unvaccinated Canadians.""",7,26n9br,http://www.np.reddit.com/r/conspiracy/comments/26mvwj/time_for_a_national_vaccine_registry_big_pharma/,1,1401230304.0,,2014-05-28 01:38:24
"We should create a list of canned speeches and place them in the sidebar, like a FAQ of sorts. They could be used as a toolbox to counter antivax claims often used.",3,26f34p,https://www.reddit.com/r/VaccineMyths/comments/26f34p/we_should_create_a_list_of_canned_speeches_and/,2,1400984661.0,"I often see rebuttals created that are often hostile or attack ad hominem rather than their specific claims, something I believe we should avoid. We shouldn't stoop to their level, they can call us shills or indoctrinated sheep, but that should not affect our argument. We should have clear, evidenced rebuttals that address all aspects of the claim. Topics may include

* Mercury
* Mercury specifically in children
* Autism
* SIDS
* Herd immunity
* Resurgence of nearly extinct polio
* et al


This should be a good starting point, but we should expand on certain topics. 

This will provide a good, standardized systematic way of combating their concerns and doubts. If they refuse our facts and evidence and still remain convinced of their pseudoscience, we need a canned as well to explain how *not* vaccinating can hurt others.",2014-05-25 05:24:21
"Since the anti-vaccination movement doesn't have any facts on their side, their new tactic is to post gish-gallops.",5,26djaz,http://www.np.reddit.com/r/conspiracy/comments/26c6ca/the_not_so_conspiracy_of_uneccesary_and_deadly/,46,1400940035.0,,2014-05-24 17:00:35
"Toni Braxton claims her son’s autism was God’s punishment for abortion, may be due to vaccinations",8,26b2il,http://www.salon.com/2014/05/23/toni_braxton_claims_her_sons_autism_was_gods_punishment_for_abortion_may_be_due_to_vaccinations/,1,1400861368.0,,2014-05-23 19:09:28
"Vaccines are linked to SIDS, according to activist post",8,26azrp,http://www.np.reddit.com/r/conspiracy/comments/26axn2/shaken_baby_syndrome_medical_science_or_medical/,4,1400859594.0,,2014-05-23 18:39:54
"""...a lot of vaccines contain a tiny bit of mercury.""",8,26azcx,http://www.np.reddit.com/r/conspiracy/comments/26ak7u/are_some_vaccines_necessary_or_are_all_of_them/chp7031,11,1400859328.0,,2014-05-23 18:35:28
The WHO contrived a polio emergency. Poster doesn't understand why vaccine is still necessary.,2,263db1,http://http://www.np.reddit.com/r/conspiracy/comments/261io3/polio_global_health_emergency_entirely_fabricated/,1,1400645699.0,,2014-05-21 07:14:59
People have been paralyzed by the flu vaccine and polio vaccine in African. Bill gates funded all those polio vaccines and then a lot of kids became sick or paralyzed from it,6,25y9en,http://np.reddit.com/r/worldnews/comments/25v7kw/study_of_13_million_kids_reveals_vaccines_arent/chldi3v,2,1400516602.0,,2014-05-19 19:23:22
Apparently this user's opinion trumps a meta-analysis showing that vaccines don't cause autism. He's also fond of the big-pharma conspiracy.,10,25xu7d,http://www.np.reddit.com/r/worldnews/comments/25v7kw/study_of_13_million_kids_reveals_vaccines_arent/chl71xo,3,1400506372.0,,2014-05-19 16:32:52
Use of a youtube video to try to prove the polio vaccine is bad. Doesn't realize there are two forms of the vaccine. Also doesn't realize that the risk of poliomyelitis is greater than the risk of VAPP. Use of nominal numbers rather than percentage to make argument about VAPP.,8,25qt7x,http://www.np.reddit.com/r/conspiracy/comments/25pr5r/pakistan_mandatory_polio_vaccination_required_for/,3,1400275424.0,,2014-05-17 00:23:44
"Fuck you Reddit, you tyrants. I am glad no one listens to you. If someone doesn't want a vaccine, then they don't have to take one, regardless of how you fuckers think",1,25qd3x,http://www.np.reddit.com/r/AdviceAnimals/comments/25pmtd/this_pisses_me_off_to_no_end/chjnkdo,1,1400265404.0,,2014-05-16 21:36:44
