title,score,id,url,comms_num,created,body,timestamp
"*SCIENTIFICALLY PROVEN*, verified and established FACTS to immediately shut down the arguments of an uneducated anti-vaxxer. This post contains facts that will help you win any vaccine debate.",8,kwt886,https://www.reddit.com/r/VaccineMyths/comments/kwt886/scientifically_proven_verified_and_established/,15,1610581499.0,"This comprehensive and thorough list of facts will help you to counter and win any vaccine debate. If an antivaxer is attacking you or making baseless/outlandish + unscientific claims, you can use this list of information to shut their arguments down immediately with facts:

\-**Vaccines are extremely safe**: in fact, *no serious adverse events* (besides injection site pain/erythema) have ever actually been proven.

\-Vaccine adverse events are notoriously **OVER** (not under!) reported. It is estimated by a Harvard study using data mining technology + VAERS reports that **adverse events are reported at 100x** (or more) the **rate that they actually occur.**

\-One study found that **97% of ""adverse events""** from vaccines are actually **nocebo effects** (like the placebo effect, people believe/imagine they are having symptoms due to fear/expectation)

\-Not **a single case of autism** has ever made it to higher courts, because the **autism + vaccine connection has an overwhelming amount of research debunking it.**

\-in 1986, vaccine manufacturers took **on increased liability** for their product to reassure the public of safety: this is because research has proven without doubt that vaccines are **incredibly safe.** Despite manufacture liability, vaccine manufactures have never actually needed to pay out any amount for any purported ""injury"" claims. The evidence is overwhelming to **debunk these claims.**

\-**Andrew Wakefield,** a public disgrace and conspiracist theorist with multiple agendas, is the **only physician or scientist** to have **ever published a medical paper criticizing vaccine safety**. His paper was later **retracted for fraud** and his licence **revoked**.

\-**Vaccine inserts** list events that occur normally in populations and **do NOT prove any causative association** between vaccines and these purported ""events"". If the events listed in vaccine inserts actually \*caused\* these effects, billions in personal injury lawsuits would be paid out --> which is *not* the case!

\-Unlike what antivaxers claim, it has been proven thoroughly that Gardasil is incredibly safe. The supposed ""injuries"" that circulate the internet in the form of horror stories can be explained psychologically by the phenomenon of mass psychogenic events, instigated by fear + the nocebo effect.

\-Vaccines have rigorous long-term safety studies for all potential of carcinogenicity, fertility, and long-term health adverse effects, and no issues have been found.

\-Despite some ethical concerns raised, several vaccinated vs. unvaccinated studies have been conducted. It was found that vaccinated children have significantly lower rates of allergies, chronic health problems, and neurological issues.

\-Vaccines are thought to have a potential neuroprotective and anti-cancer effect, which is still being studied. It is suspected that vaccines may prevent infertility, dementia, and cancer, although further investigation is needed.

\-All clinical trials for vaccines use double-blinded trials with saline placebos, which is the gold standard in medical research.

\-The FDA has an independent taxpayer-funded committee to examine and analyze all raw data from vaccine clinical trials. Scientists and data analysts conducting this research have extensive background testing to ensure no conflicts of interest in any pharmaceutical company. This debunks the myth of ""conflict of interest"" regarding vaccine manufacturers funding their own safety studies for FDA/CDC approval.

\-There are comprehensive laws to prevent the myth of the “revolving door” phenomenon that anti-vaxers like to use as proof of government-pharmaceutical corruption. If a scientist/researcher who investigated vaccine safety has had any financial ties to a pharmaceutical company, they are disqualified from the vaccine approval committee. Similarly, once an individual has worked in the field of vaccine approval for the FDA/CDC, they are unable to accept positions as pharmaceutical-hired scientists. These laws prevent conflicts of interest between vaccine approval and pharmaceutical profit.

\-Studies of vaccinated vs unvaccinated infants have thoroughly refuted any claims linking vaccines to SIDS.

\-The USA has very high vaccination rates as well as one of the lowest rates of infant mortality in all developed nations.

\-France, which has a notoriously high rate of vaccine hesitancy, has higher rates of autism, SIDS, and chronic illnesses than other developed countries of similar socioeconomic structure.

\-Autism is “more prevalent” due to more advanced and specific diagnostic criteria. Once diagnostic criteria was established, people of older generations (age 50’s-80’s) were found to have nearly identical rates of autism to those of younger generations (age 40’s and under).

**Source: CDC, WHO, and FDA.**

If an antivaxer ever tries to argue with you about the safety of vaccines, this comprehensive list of facts will immediately shut down all their false claims and misunderstanding. Don’t let false information spread! Share this to anyone who needs to hear it.

TL;DR: FACTS to fight + win any antivax debate.",2021-01-14 01:44:59
"I’m Allergic to Penicillin, Will I Take the COVID Vaccine?",0,kw3ll2,https://medium.com/beingwell/im-allergic-to-penicillin-will-i-take-the-covid-vaccine-69d85d6613f0,9,1610494079.0,,2021-01-13 01:27:59
Johnson & Johnson COVID phase 3 trial,8,kvirym,https://www.reddit.com/r/VaccineMyths/comments/kvirym/johnson_johnson_covid_phase_3_trial/,2,1610420362.0,"I got the J&J vaccine about 40 days ago in their phase 3 trial and don’t have any problems after some initial minor nerve pains in my legs.  They closed the one shot trial but have a 2 shot trial still open so my wife got in that one and her first shot is in a few days so I’m hoping she gets the vaccine also and not the placebo.  

I looked at it as a way to get a vaccine earlier and it worked.  But if I got the placebo, they said we would get the vaccine once it is approved so again I would’ve gotten it earlier.  Or I could take another vaccine if one became available.

My goal was to avoid catching COVID and get a vaccine.

So these phase 3 trials from J&J and other companies are a way to get a chance to get a vaccine early.",2021-01-12 04:59:22
"My parents got both doses of the Chinese covid vaccine but the Pfizer came out recently. Can they still take the Pfizer vaccine as well? If so, how much of a time gap should they keep",0,krl2zy,https://www.reddit.com/r/VaccineMyths/comments/krl2zy/my_parents_got_both_doses_of_the_chinese_covid/,8,1609927770.0,"My 67 year old father (65 kgs, has hypertension, type two diabetes) has been inoculated with the inactivated sinovac COVID-19 Vaccine (both doses). He is not overweight and exercises regularly. We had to get him inoculated due to the increasing virus transmission rate as well as the easy access to the Chinese sinovac vaccines in our country. 

However, recently out country introduced the Pfizer vaccine and opened up access to elderly people. I would like my dad to get vaccinated with Pfizer vaccine as well as I trust it more that the sinovac vaccine, due to the level of peer reviewed research published on the former candidate. 

Please advise on if he is able to take the Pfizer vaccine as well. If so, please advise how long of a gap should he keep between the last dose of the Sinovac vaccine and the first dose of the Pfizer vaccine. 

P.S. After inoculation of the Sinovac vaccine, my father did not experience and adverse effects or experience any side effects.",2021-01-06 12:09:30
Vaccine,2,kpm95n,https://www.reddit.com/r/VaccineMyths/comments/kpm95n/vaccine/,1,1609687104.0,"&#x200B;

https://preview.redd.it/mr1ba23vx4961.png?width=500&format=png&auto=webp&s=1a5cbeade983b7978c7136b7fdbc608898c2b278",2021-01-03 17:18:24
Well this is sad,6,khtmqn,https://i.redd.it/cgks1zamqm661.jpg,1,1608595445.0,,2020-12-22 02:04:05
Vaccines exposed,37,kfctnr,https://i.redd.it/3ebjmlp8uk561.jpg,4,1608261072.0,,2020-12-18 05:11:12
COVID19 Vaccination sentiments survey,4,kdfi7x,https://www.reddit.com/r/VaccineMyths/comments/kdfi7x/covid19_vaccination_sentiments_survey/,2,1608009530.0,"Dear all,

We have prepared a short #survey, where you can express your opinion about the #COVID19Vaccine #CoronaVaccine.

If you are living in the #USA, we will be grateful if you will participate and share:
[COVID19 Vaccination survey](https://forms.office.com/Pages/ResponsePage.aspx?id=IYhnPFB3o0eTfyZhQ5q7eqGjfqSLSvhBqoV3r-scx2hUNkZGQlpBRDNMWTdTU1I0QUhESjhNWURPNC4u)

#COVID19 #vaccine #vaccination #coronavirus #pandemic #covid #research #publichealth #health #medicine #covid19insights

Thanks for taking and sharing this survey!

The Investigators

Prof. Abraham Seidmann, Boston University, Boston, MA, USA,
Dr. Arriel Benis and Prof. Shai Ashkenazi, Holon Institute of Technology, Tel-Aviv, Israel",2020-12-15 07:18:50
"Officials confront challenges to get public to take COVID vaccine. 'A new ABC News/Ipsos poll released Monday found that more than 80% of Americans planned to get the vaccine, either when immediately available, or eventually. It signals growing confidence in the vaccine..'",2,kd1mf5,https://abcnews.go.com/Health/officials-confront-challenges-public-covid-vaccine/story?id=74708303,1,1607965632.0,,2020-12-14 19:07:12
Delicious,21,k8tios,https://i.redd.it/hy7qvpohzu361.jpg,1,1607387739.0,,2020-12-08 02:35:39
The last COVID vaccine,0,k7z13k,https://youtu.be/v_hFsRJ3pqU,0,1607279198.0,,2020-12-06 20:26:38
"Is there any truth in this article that states, zero child out 562 didn’t develop adha, were 0006% did that were vaccinated.",3,k4ww49,https://informedchoicewa.org/news/its-here-the-vaxxed-vs-unvaxxed-study/?fbclid=IwAR3LG0IHlIGQdmIxEiB0b39VGKQbfHiX_iB0B2enLJDktJ-VKL_tuj9GvNg,7,1606865139.0,,2020-12-02 01:25:39
Measles – An overview,3,k0nnhw,https://medsphere.wordpress.com/2020/11/25/measles/,0,1606289662.0,,2020-11-25 09:34:22
Why Scientists & Public Health Officials Need To Address Vaccine Mistrust Instead of Dismissing it,4,jmopup,https://onlinemarketingscoops.com/why-scientists-public-health-officials-need-to-address-vaccine-mistrust-instead-of-dismissing-it/,0,1604328496.0,,2020-11-02 16:48:16
The future is ‘CLEAR’ and it’s Dystopian: Virus hype ushers in a Covid 19-84 nightmare of restricted access — RT Op-ed,0,i5gs97,https://www.rt.com/op-ed/497272-clear-health-pass-covid-dystopian/,0,1596817183.0,,2020-08-07 19:19:43
Lol,1,i3ytpi,https://www.reddit.com/r/VaccineMyths/comments/i3ytpi/lol/,0,1596601947.0,"&#x200B;

https://preview.redd.it/der9arzr34f51.png?width=702&format=png&auto=webp&s=11b00743183670fbdda1773c6ae8dda5dd2ce5bc",2020-08-05 07:32:27
Vaccine = Mind Control,16,htmgsa,https://i.redd.it/g9ona2hs2ob51.jpg,4,1595100358.0,,2020-07-18 22:25:58
Enough is enough,2,heokpe,https://youtu.be/VLfZhUCX86s,1,1592951300.0,,2020-06-24 01:28:20
"I felt the need to question why this Anti Vaccine page spreads misinformation, Misinformation that can be so dangerous in the time of a pandemic",17,gqmbdm,https://i.redd.it/3ez33zl430151.jpg,3,1590451423.0,,2020-05-26 03:03:43
.,13,gosvog,https://i.redd.it/rvq3nab93e051.jpg,5,1590185115.0,,2020-05-23 01:05:15
If I drink alcohol the day before or the after the vaccine will it affect the vaccine?,6,gnivbp,https://www.reddit.com/r/VaccineMyths/comments/gnivbp/if_i_drink_alcohol_the_day_before_or_the_after/,1,1590005447.0,,2020-05-20 23:10:47
What is the mortality rate of vaccinated vs unvaccinated children right now?,3,gm03sw,https://www.reddit.com/r/VaccineMyths/comments/gm03sw/what_is_the_mortality_rate_of_vaccinated_vs/,1,1589803121.0,,2020-05-18 14:58:41
"I'm not necessarily anti-vaccine but we need to talk about the specific companies that are distributing them, freely and openly",0,gk7vy5,https://i.redd.it/v55j8ufy5xy41.png,8,1589544382.0,,2020-05-15 15:06:22
Why some common arguments about autism don't work,0,gfivrb,/r/VaccineDiscussion/comments/gfhov5/why_some_common_arguments_about_autism_dont_work/,5,1588898114.0,,2020-05-08 03:35:14
Why are the world’s top vaccine promoters frantically warning us about the unique and frightening dangers inherent in developing a coronavirus vaccine?,1,g1zp4n,https://www.reddit.com/r/VaccineMyths/comments/g1zp4n/why_are_the_worlds_top_vaccine_promoters/,1,1586981420.0,"From:

[https://childrenshealthdefense.org/news/heres-why-bill-gates-wants-indemnity-are-you-willing-to-take-the-risk/](https://childrenshealthdefense.org/news/heres-why-bill-gates-wants-indemnity-are-you-willing-to-take-the-risk/)

&#x200B;

Why are the world’s top vaccine promoters, like Paul Offit and Peter Hotez, frantically warning us about the unique and frightening dangers inherent in developing a coronavirus vaccine?

Scientists first attempted to [develop coronavirus vaccines](https://www.ncbi.nlm.nih.gov/pubmed/22536382) after China’s 2002 SARS-CoV outbreak. Teams of US & foreign scientists vaccinated animals with the four most promising vaccines. At first, the experiment seemed successful as all the animals developed a robust antibody response to coronavirus. However, when the scientists exposed the vaccinated animals to the wild virus, the results were horrifying. Vaccinated animals [suffered hyper-immune responses](https://www.ncbi.nlm.nih.gov/pubmed/22536382) including inflammation throughout their bodies, especially in their lungs. Researchers had seen this same “enhanced immune response” during human testing of the [failed RSV vaccine tests](https://cvi.asm.org/content/23/3/189) in the 1960s. [Two children died](https://cvi.asm.org/content/23/3/189).

In this video footage, Offit, Hotez and even Anthony Fauci (in an unguarded moment), warn that any new coronavirus vaccine could trigger lethal immune reactions “vaccine enhancement” when vaccinated people come in contact with the wild virus. Instead of proceeding with caution, Fauci has made the reckless choice to [fast track](https://www.businesswire.com/news/home/20200316005666/en/Moderna-Announces-Participant-Dosed-NIH-led-Phase-1) vaccines, partially [funded by Gates](https://www.kiro7.com/news/local/bill-gates-says-foundation-will-invest-billions-fight-stop-covid-19/MMAFTSVGKZHPTEGYKEQKMRWTWU/), without critical [animal studies](https://www.statnews.com/2020/03/11/researchers-rush-to-start-moderna-coronavirus-vaccine-trial-without-usual-animal-testing/) before moving into human clinical trials that could provide early warning of runaway immune response.

Gates (in the video) is so worried about the danger of adverse events that he says vaccines shouldn’t be distributed until governments [agree to indemnity](https://www.cnbc.com/video/2020/04/09/watch-cnbcs-full-interview-with-microsoft-co-founder-bill-gates-on-past-pandemic-warnings.html?__source=iosappshare%7Ccom.apple.UIKit.activity.Mail&fbclid=IwAR0RG79OtbdXUpY_ylULT6sY_Xo5D-cBQ0awSo6vGS19VnLGqB9z)against lawsuits. On February 4, 2020, according to the Centers for Disease Control (CDC) [website](https://www.cdc.gov/coronavirus/2019-ncov/cases-updates/cases-in-us.html), there were only [11 active CV cases](https://www.cdc.gov/coronavirus/2019-ncov/cases-updates/cases-in-us.html) in the USA, yet the U.S. quietly pushed through [Federal regulations](https://www.phe.gov/Preparedness/legal/prepact/Pages/COVID19.aspx) giving coronavirus vaccine makers full immunity from liability.

&#x200B;

""...""",2020-04-15 23:10:20
Have you heard any myth about Coronavirus Vaccine?,1,fuaq4z,https://i.redd.it/mu49q1ducmq41.jpg,1,1585928860.0,,2020-04-03 18:47:40
Is There Any Vaccine Available For Coronavirus (COVID-19)?,2,fua146,https://www.reddit.com/r/VaccineMyths/comments/fua146/is_there_any_vaccine_available_for_coronavirus/,2,1585926474.0,Novel Coronavirus is a big threat to the world and all the doctors are trying to make the vaccine of COVID-19. But there is no such dedicated and preventive [coronavirus vaccine](https://lifestyleheart.com/is-there-any-vaccine-available-for-coronavirus-covid-19/) is available in the world medical centers.,2020-04-03 18:07:54
Check this out 😊,5,frbw72,https://www.facebook.com/102941431365157/posts/103010051358295/,0,1585511022.0,,2020-03-29 22:43:42
Now where are those people who says vaccine are bad we don't have vaccine for covid 19 and whole world is fucked up,9,fqzmys,https://www.reddit.com/r/VaccineMyths/comments/fqzmys/now_where_are_those_people_who_says_vaccine_are/,1,1585455279.0,,2020-03-29 07:14:39
Is my daughter safe?,7,fmsids,https://www.reddit.com/r/VaccineMyths/comments/fmsids/is_my_daughter_safe/,21,1584845288.0,"This might be a stupid question, and forgive me but I would very much like to know. My daughter is 2, up to date on vaccines, no underlying health issues. Is she fully protected from the diseases she is vaccinated for? Do I need to worry about if she is around unvaccinated children? I don’t know all of the vaccine arguments and debates, but I do know I believe in them and they save lives. Any info would be appreciated",2020-03-22 04:48:08
"Having a youtube comment debate, how do I respond to this?",6,fl6mot,https://i.redd.it/hcfyu45obln41.png,4,1584606700.0,,2020-03-19 10:31:40
Supreme court antivax case,7,ffx8bp,https://www.reddit.com/r/VaccineMyths/comments/ffx8bp/supreme_court_antivax_case/,11,1583771032.0,So a nurse friend of mine is antivax(idk how she gets a job). She posted some cdc vs icandecide supreme court case. I'm trying to find formation about the case but cant find anything online except for what she provided. Apparently the ruling was that the cdc doesnt have any proof that vaccines did not cause autism. Any help or clarification?,2020-03-09 18:23:52
How ironic,30,feb0wn,https://i.redd.it/3p53rb7hs0l41.jpg,3,1583486379.0,,2020-03-06 11:19:39
Hmm,19,f1w9rj,https://i.redd.it/hnu1yiwbo5g41.png,1,1581366278.0,,2020-02-10 22:24:38
Are vaccines made by pompous people?,0,f05tlq,https://www.reddit.com/r/VaccineMyths/comments/f05tlq/are_vaccines_made_by_pompous_people/,15,1581052672.0,"Is it more likely that Corona and other viruses like SARS, Avian and ZIKA

are man-made diseases implanted through vaccinations years in advance inadvertantly 

that are triggered when common diseases infect the contaminated cells?

_ can blind faith in medical practices and practioners be our ultimate demise.",2020-02-07 07:17:52
My mom is adamant that there are aborted fetus cells in vaccines,15,ewfixs,https://www.reddit.com/r/VaccineMyths/comments/ewfixs/my_mom_is_adamant_that_there_are_aborted_fetus/,11,1580430576.0,Are there really? Can someone explain to me why this scare started and give sources that suggest otherwise?,2020-01-31 02:29:36
I’m having a debate and I can’t find any links online,4,etjlw2,https://www.reddit.com/r/VaccineMyths/comments/etjlw2/im_having_a_debate_and_i_cant_find_any_links/,5,1579913327.0,"So my question is do getting vaccines boost your overall immune system and helping fight off diseases, bacterial infections, and viruses?",2020-01-25 02:48:47
Anti-Vaxer Harassment,1,eqknqd,https://www.dispatch.com/news/20200117/cincinnati-pediatrician-created-viral-tiktok-video-supporting-vaccinations-then-things-got-ugly,0,1579374144.0,,2020-01-18 21:02:24
What should I say to my sister who keeps sending me crap like this??,13,enrmmu,https://i.redd.it/2a9b21etaea41.jpg,20,1578855607.0,,2020-01-12 21:00:07
Vaccines DO CAUSE AUTISM,0,en62e6,https://www.reddit.com/r/VaccineMyths/comments/en62e6/vaccines_do_cause_autism/,9,1578739919.0,My wonderful daughter hailey got what seems like autism from vaccines she got! 1 vaccine made her autistic and the doctor lied to us saying she wouldn’t become autistic. we are now curing her autism with essential oils like lavender and using crystals to purify her mind and spirit,2020-01-11 12:51:59
Vaccinate folks.,26,em2eo8,https://i.redd.it/nvz6th3ynn941.jpg,7,1578533137.0,,2020-01-09 03:25:37
STROKE AFTER FLU SHOT,1,ejon4x,https://www.reddit.com/r/VaccineMyths/comments/ejon4x/stroke_after_flu_shot/,8,1578098007.0,A girl I work with had two strokes after getting a flue shot.  Has any one else heard of this?,2020-01-04 02:33:27
The World Health Organization Are Hypocrites,4,eixjck,https://youtu.be/X7_O-ynxenI,22,1577967384.0,,2020-01-02 14:16:24
"How I left the antivax movement and took others with me, and what we need to do to counter unscientific thinking",9,ehzxhg,/r/VaccineDiscussion/comments/ehji1f/how_i_left_the_antivax_movement_and_took_others/,0,1577778942.0,,2019-12-31 09:55:42
Common vaccine fallacies to avoid,0,eg7m7g,/r/VaccineDiscussion/comments/chwrg7/common_vaccine_fallacies_to_avoid/,3,1577428498.0,,2019-12-27 08:34:58
Anti vax billboard in my town!!! Help,25,eetdr4,https://i.redd.it/fq5lp10r8h641.jpg,18,1577147843.0,,2019-12-24 02:37:23
Do you guys think it's alright to censor anti-vaccination information? If it's such bullshit why bother?,6,ea6zt6,https://i.redd.it/ri2h6p64of441.png,49,1576258189.0,,2019-12-13 19:29:49
Can't fix stupid.,8,ea4yvg,https://www.newsweek.com/anti-vaxxers-refuse-leave-nj-transit-meeting-despite-being-told-theyre-protesting-wrong-place-1477063,0,1576248924.0,,2019-12-13 16:55:24
Brave Baby Yoda.,21,e758iq,https://i.redd.it/svaea3xm43341.jpg,5,1575669418.0,,2019-12-06 23:56:58
To the Kevin whomst this message is directed,6,e29q5r,https://i.redd.it/ul2wpkgrb5141.jpg,4,1574824332.0,,2019-11-27 05:12:12
Do live vaccines shed?,6,e229g6,https://www.reddit.com/r/VaccineMyths/comments/e229g6/do_live_vaccines_shed/,10,1574793494.0,"After you get a live vaccine do you need to stay away from elderly / newborns / immunocompromised? I can't find any solid studies that show vaccines can spread disease. In fact, all I can find are studies debunking this. But sources say *in theory* it could happen. So just curious if anyone has better info or links to help me out",2019-11-26 20:38:14
A mom friend is excited her kids got chicken pox,10,e1l9oc,https://www.reddit.com/r/VaccineMyths/comments/e1l9oc/a_mom_friend_is_excited_her_kids_got_chicken_pox/,5,1574710453.0,"I posted this on the antivaxxers too because I don’t know where it belongs.  

I guess i have many questions. 



Why is this mom excited about the chicken pox?



Is it not dangerous?



What do anti vaxxers believe that would make getting the chicken pox exciting?



My kids are both fully vaccinated (4 and 2 years old), are they protected?



My husband never got the chicken pox but got a vaccine when he was a kid, is he protected?



I am pregnant but had them as a kid, am i protected?



Arent your risk of getting shingles greatly increased if you have had the chicken pox?



If anti vaxxers get excited that your body builds natural immunity after having the disease, isnt that what vaccines do for your body except your never ""sick""?



Bonus, she posted about it and many moms commented how happy they are her and that they wish they were closer so they could go over. I was very confused and also didn't realized i knew this many moms that believed this lol..",2019-11-25 21:34:13
Anyone able to help with a uk university survey?,6,e144c2,https://forms.gle/ZtxQZQSj3zqbZA7U9,1,1574627334.0,,2019-11-24 22:28:54
Anti-Vax Nurse?!,7,dwwffd,https://www.reddit.com/r/VaccineMyths/comments/dwwffd/antivax_nurse/,27,1573849752.0,"Sorry if this is the wrong sub, but I don’t know where else to post this.

My dad is dying of congestive heart failure. He has temporary home healthcare due to procedures he just had done on his heart, and the latest nurse shared that she believes in the autism-vaccine link as well as “bad chemicals hurting people”, and she agrees with her daughter about delaying vaccines for the grandkids. My dad is also anti-vax. I brought up vaccines hoping that she could talk some sense into my dad about getting a pneumonia vaccine but instead ran into this baffling BS. It’s so frustrating. My dad is already hard headed enough. 

I’m starting to get frustrated with nurses and PAs stepping on doctors’ orders after talking to my dad for less than 30 minutes and taking a brief history. The last PA he saw also cleared him to stop taking one of his heart failure medications that his cardiologist prescribed. We had to badger him into taking his meds after that. I can only hope his cardiologist talked some sense into him today.",2019-11-15 22:29:12
Need help with an anti-vaxxer on Reddit,5,dtu0rj,https://www.reddit.com/r/VaccineMyths/comments/dtu0rj/need_help_with_an_antivaxxer_on_reddit/,32,1573292979.0,"Hi all.

They’re saying things like double-blind studies and aluminium and have provided sources and stuff but I don’t know how to combat that and I most CERTAINLY don’t want to walk away from this with a little bit of doubt about vaccines, just because I didn’t know enough to hold a discussion about it, but I also don’t want to cling to a belief even when I’m presented with good evidence. Problem is, I don’t know if it’s good bloody evidence!

Where can I get sources? Would anybody who knows more about the subject matter like to ‘casually’ step in to the argument? I feel like an audience member in a debate and I’ve just been made to take part!",2019-11-09 11:49:39
