title,score,id,url,comms_num,created,body,timestamp
Comment,1,hc1eitk,,0,1631092333.0,She felt the coin slightly being pulled. Edit: before contact.,2021-09-08 12:12:13
Comment,1,hc1efkt,,0,1631092249.0,Euro,2021-09-08 12:10:49
Comment,5,hbzxh4j,,0,1631059619.0,"Was she using USA coins?  If so, they are not magnetic.  Sweat and surface oils help things like coins lightly attach to skin, and some people mistake that for a magnetic pull.  Try picking up the same coin with a regular magnet, it won't work.",2021-09-08 03:06:59
Comment,1,hbzry9z,,0,1631057041.0,!optout,2021-09-08 02:24:01
Comment,1,hbzrvyk,,0,1631057011.0,Bad bot,2021-09-08 02:23:31
Comment,1,hbzrrjy,,0,1631056954.0,"Art thee sure t didn't just stick to that lady due to did sweat?

***



^(I am a bot and I swapp'd some of thy words with Shakespeare words.)

Commands: `!ShakespeareInsult`, `!fordo`, `!optout`",2021-09-08 02:22:34
Comment,2,hbzrqaa,,0,1631056937.0,Are you sure it didn't just stick to her due to sweat?,2021-09-08 02:22:17
Comment,1,hby4ij6,,0,1631031858.0,Juuust a little outside,2021-09-07 19:24:18
Comment,1,hby3zcj,,0,1631031641.0,Is she vaccinating the boob?,2021-09-07 19:20:41
Comment,1,h8l2sm2,,0,1628717849.0,You sign a consent and that removes a lot fron the facility. How they react to your allergic reaction is what they'd be responsible for. Get a thorough informed consent and ask questions.,2021-08-12 00:37:29
Comment,1,h8l2hc8,,0,1628717717.0,"I don't think there's any metal in the vaccines so... 

👀",2021-08-12 00:35:17
Comment,1,h8l27ep,,0,1628717604.0,"Maybe do research first and you can present 
s c i e n c e? 

You said you haven't done much research so, there's a start.",2021-08-12 00:33:24
Comment,1,h891rdx,,0,1628483426.0,What,2021-08-09 07:30:26
Comment,1,h4hhqcr,,0,1625759624.0,"Sheer Luck Holms, heard of him?",2021-07-08 18:53:44
Comment,1,h4heu1m,,0,1625758347.0,Poor kid. What grade had that in a science book?,2021-07-08 18:32:27
Comment,1,h4hepe1,,0,1625758290.0,"""Once you eliminate the impossible, whatever remains, no matter how improbable​, must be the truth""

So yeah",2021-07-08 18:31:30
Comment,1,h4hdy0j,,0,1625757955.0,It's certainly not what you said.,2021-07-08 18:25:55
Comment,1,h4hdph8,,0,1625757849.0,Must be the vaccine then,2021-07-08 18:24:09
Comment,1,h4hdljf,,0,1625757800.0,Every week on Wednesdays,2021-07-08 18:23:20
Comment,1,h4hdibf,,0,1625757760.0,Did they test for Fibrodysplasia ossificans progressiva (FOP)?,2021-07-08 18:22:40
Comment,1,h4hd5qg,,0,1625757604.0,No OTHER cause was found. Do you even english?,2021-07-08 18:20:04
Comment,1,h4hck0a,,0,1625757331.0,"Causation doesn't mean correlation. Especially if nothing could be found. Same could be said if someone was hit and killed leaving a clinic after getting vaccinated. Were their vision affected by the shot? He's never walked out in front of a truck before, the shot was the only difference so it must of been the shot",2021-07-08 18:15:31
Comment,1,h4hbn6y,,0,1625756911.0,Healthy two month old developed stomach ulcers from mother's vaccinated breast milk. Baby started vomiting blood two days after mom was jabbed. No exposure to anything other than mother's moderna mRNA milk. No other possible cause was found.,2021-07-08 18:08:31
Comment,1,h466mgq,,0,1625521832.0,"I just thought it was funny, you can still see the needle",2021-07-06 00:50:32
Comment,1,h466859,,0,1625521624.0,Bad Photoshop.,2021-07-06 00:47:04
Comment,1,h42s4kv,,0,1625442717.0,"No vaccine, no sex. Stand firm dude",2021-07-05 02:51:57
Comment,1,h3zomfk,,0,1625372097.0,Still waiting for you to address the actual science pertaining to the vaccines.,2021-07-04 07:14:57
Comment,-3,h3vvys0,,0,1625283719.0,You fool lol. How do you not get it? Damn you people are stupid,2021-07-03 06:41:59
Comment,6,h3v86sm,,0,1625269855.0,This doesn't address any of the actual science pertaining to the vaccine.,2021-07-03 02:50:55
Comment,2,h2xofvj,,0,1624576783.0,Amen.,2021-06-25 02:19:43
Comment,-1,h2m933l,,0,1624335880.0,Read the report or not. The choice is up to you.,2021-06-22 07:24:40
Comment,7,h2m8pu2,,0,1624335630.0,"""VAERS is a passive reporting system, meaning it relies on individuals to send in reports of their experiences to CDC and FDA. VAERS is not designed to determine if a vaccine caused a health problem, but is especially useful for detecting unusual or unexpected patterns of adverse event reporting that might indicate a possible safety problem with a vaccine. This way, VAERS can provide CDC and FDA with valuable information that additional work and evaluation is necessary to further assess a possible safety concern."" - F. A. Q. answer of What is VAERS? of said website.",2021-06-22 07:20:30
Comment,3,h2l1y9v,,0,1624311985.0,How to convince someone? You don’t. You’ll drive yourself nuts trying,2021-06-22 00:46:25
Comment,1,h1xd434,,0,1623812514.0,I would donate him my vaccine but I dont think that can be done,2021-06-16 06:01:54
Comment,0,gy4xnwb,,0,1621021185.0,I have to dm you can't link here,2021-05-14 22:39:45
Comment,1,gy4fko9,,0,1621013281.0,You may not be lying. Doesn't mean you're playing with the full deck and can be trusted in matters of objective reality.,2021-05-14 20:28:01
Comment,0,gy46z6k,,0,1621009604.0,"Gene editing experimental mRNA frankenshot that killed every animal in every study, go brrrrr",2021-05-14 19:26:44
Comment,2,gy455x1,,0,1621008831.0,Lol.,2021-05-14 19:13:51
Comment,0,gy44579,,0,1621008398.0,"YOU. ARE. DUMB. And part of the issue regarding people who don’t want the vaccine. It is forced. You have NO freedom if you aren’t vaccinated and what is this country supposed to be? FREE. Can’t go to work, shop, school, university, etc.... unless your vaccinated. Not everybody is able to do everything from home. You should not be told you can’t do ANYTHING unless you get the vaccine, especially when a vaccine is out that protects you from covid therefore putting nobody at risk. Holding something above our head like kids is wrong.

It’s MANDATORY if you want your freedom. And your “ScIeNce” and “BiDeN” and “FaUcI” few days ago was spewing bullshit about wearing masks and blah blah then yesterday, literally one day later, announced no more masks for vaccinated people with absolutely no new science, nothing changed. 

It has nothing to do with not trusting doctors or nurses or medical experts. It has everything to do with politics and the influence they hold over doctors/nurses and medical experts. They will do what Biden says and wants no matter what. They’ve completely contradicted themselves multiple times by taking back something they said cause Biden said opposite.

And BY THE WAY- the “ScIeNcE” SHOWS STATES THAT DUMPED THAT TRASH MANDATE OF MASKING... HAVE LESS OR FEWER contracted COVID CASES THAN STATES THAT DIDNT! LOL DUMBASS.",2021-05-14 19:06:38
Comment,0,gy43ano,,0,1621008029.0,"I knew that you libtards weren't stupid, you legit just want people to die",2021-05-14 19:00:29
Comment,1,gy40woq,,0,1621007011.0,"What's my motivation for lying, my only motivation is to save as many lives as I can, even if it's the life of a libtard",2021-05-14 18:43:31
Comment,1,gy3yhuq,,0,1621005989.0,Sure mate.,2021-05-14 18:26:29
Comment,1,gy3bxry,,0,1620995479.0,"The vaccine effectively destroys any natural immunity you have, by replacing your Non-specific antibodies with specific antibodies. These specific antibodies crowd out the natural Non-specific antibodies, causing your entire immune system to not only have an autoimmune response, but also be completely open viral or bacterial infection. Yall ready for the mass death that you sleeping sheep walked right into",2021-05-14 15:31:19
Comment,1,gy3bdqb,,0,1620995162.0,"This is what you call Stockholm syndrome, Fauci is your kidnapper and your savoir 
The ""vaccine"" is deadly, wake up. This will be the most unfortunate I told you so of my life, I've already had two family members die from serious reaction to the vaccine, and I know dozens that are having bad reactions already.  2 years from now, we will see mass death, 7 years, the world will be unrecognizable, they will say covid variants till we're 95% of us are dead, under the United Nations plan: Agenda 21",2021-05-14 15:26:02
Comment,1,gy3azov,,0,1620994936.0,"Most people get past the first few weeks, the true intended time to kill the challenged subject is 2-7 years. Thousands of people are winding up severely injured, paralyzed, and dying already, to a poison intended to kill you in a 2-7 years. 150,000 VAERS serious life threatening reactions recorded. More people have died in the last 4 months from these frankenshots, than all vaccines combined. God bless your family, its time to stand up and fight. Prevent anyone you know from getting th poison, we have been duped and they are killing us with our eyes wide shut",2021-05-14 15:22:16
Comment,0,gy3agnc,,0,1620994630.0,"You realize more people have died in the last 4 months from these vaccines than all vaccines combined in the last 20 years. Yall honestly deserve what's coming for being the asleep behind the wheel. They tell you they want to depopulate, they stir up a virus, they make a dangerous experimental vaccine that kills every animal they tested it on, now they say to the sheep, roll up your sleeve. Might as well throw yourself in the incinerator and cut out the middleman for these nazis",2021-05-14 15:17:10
Comment,1,gxzyf73,,0,1620925541.0,"Besides you event put the references to justify your sentences,

When debating with antivaxers, its like doing the same with a flat earther or a religious cultist, or tring to stop the ocean waves... you never win.

&#x200B;

*“The glory which is built upon a lie soon becomes a most unpleasant*   
*incumbrance. …  How easy it is to make people believe a lie, and how*   
*hard it is to undo that work again!” – Autobiographical dictation, 2*   
*December 1906. Published in Autobiography of Mark Twain, Volume 2 (University of California Press, 2013)*",2021-05-13 20:05:41
Comment,1,gx9r5gx,,0,1620393839.0,"I'm not saying there's a chip in it, but if I had to make the argument I would say redundancy. There can never be enough ways to track someone down and the further we get into the future, the harder it will be to truly be off the grid. But again, not saying there's a chip.",2021-05-07 16:23:59
Comment,1,gwr1mve,,0,1620020007.0,It's immunology 101.,2021-05-03 08:33:27
Comment,1,gwnxd31,,0,1619965214.0,"""your immune system is preparing itself to handle the actual covid.."" that's not scientific, what a useless information.",2021-05-02 17:20:14
Comment,0,gwnwdt4,,0,1619964788.0,"Dude, you are such a stereotype. I know a lot of antivaxxers say untrue schizo shit, but.. There are real documented dangers. Even reddit is full of people saying how much they got fucked by a jab.",2021-05-02 17:13:08
Comment,1,gvyj4mg,,0,1619461675.0,"  

[https://nojabforme.info/?fbclid=IwAR0ThruMK6lsXn8tCopVvx9HgYy00LHTECc86BpPXTp2O947dLaqXD1GsP8](https://nojabforme.info/?fbclid=IwAR0ThruMK6lsXn8tCopVvx9HgYy00LHTECc86BpPXTp2O947dLaqXD1GsP8)",2021-04-26 21:27:55
Comment,0,gvxm3im,,0,1619447597.0,"Most of this comment is wrong

>If you’re so paranoid that you refuse to believe in science that’s been widely practiced for hundreds of years

No vaccine in use today has been used for hundreds of years (though that is probably a good thing)

Also I have already had my first dose

>then you A.) get a medical exemption, or B.) home school.

Medical exemptions are only if you have a documented contraindication, and homeschool is impossible for some people, so yes, requiring vaccines for school does in fact force people to take them, some states also require vaccines for homschool

>But this idea that “They” are pushing to make the vaccine mandatory is  laughable to anyone who doesn’t get all their information from Instagram  wellness influencers or YouTube videos of guys in MAGA hats screaming  in their trucks

Wrong [https://www.stamfordadvocate.com/opinion/article/Editorial-Why-a-COVID-vaccine-for-children-16071946.php](https://www.stamfordadvocate.com/opinion/article/Editorial-Why-a-COVID-vaccine-for-children-16071946.php)",2021-04-26 17:33:17
Comment,1,gvx6i9h,,0,1619439372.0,You can still homeschool if you have a problem with mandatory vaccines at public schools. It all depends on just how far you want to take this conviction to be against vaccines.,2021-04-26 15:16:12
Comment,0,gvwoomp,,0,1619423915.0,">Some states have requirements for school and certain limit jobs, but  that’s very different than someone “forcing” you to put something in  your body.

You are forced to go to school though...",2021-04-26 10:58:35
Comment,1,gvwomx5,,0,1619423869.0,">There have not been any deaths attributed to any of the vaccines

False [https://www.politico.com/news/2021/04/23/cdc-panel-j-j-vaccine-decision-484447](https://www.politico.com/news/2021/04/23/cdc-panel-j-j-vaccine-decision-484447)",2021-04-26 10:57:49
Comment,1,gvwefyi,,0,1619415144.0,You have strange ideas if you think an unanticipated drug reaction is someone's fault.  Are you expecting to hire some antivax greedhead lawyer to sue someone if you break out in hives?,2021-04-26 08:32:24
Comment,1,gvuxs3d,,0,1619384913.0,My point exactly if I’m forced to inject something into myself and I have an allergic reaction who’s fault would that be?,2021-04-26 00:08:33
Comment,3,gvuezkh,,0,1619375966.0,"There have not been any deaths attributed to any of the vaccines, and there isn’t a single chemical compound on the face of the earth that hasn’t had any sort of side effect when given to people. You can literally be allergic to water and you’re primarily made of the stuff.",2021-04-25 21:39:26
Comment,4,gvueqnp,,0,1619375847.0,"God, this country sucks that this is even a question.",2021-04-25 21:37:27
Comment,1,gvsb016,,0,1619324403.0,"Aha. Fauci won't let that happen here :)  
But seems like it might not need too, we're hogging the vaccines",2021-04-25 07:20:03
Comment,1,gvr77xy,,0,1619302032.0,Make sure she has all her piercings out,2021-04-25 01:07:12
Comment,1,gvqvfs7,,0,1619295969.0,Yeah unfortunately where I am the government decided to spread the vaccines out 3-4 months to get more people with their first shot.,2021-04-24 23:26:09
Comment,2,gvquv6a,,0,1619295674.0,"It doesn't do anything, so the only effect will be on her wallet and being near an anti-science wacko that's probably anti-vaccine and might have covid.

If your mother had the first Pfizer 2 weeks ago then shouldn't she get the second one in a week's time ? Or are they spreading them out to get more people the first shot where you are ?",2021-04-24 23:21:14
Comment,2,gvqmc0d,,0,1619291369.0,"Yeah that’s true. Good thing is she doesn’t see her too often. So that gives me enough time to continue talking her up to the vaccine. 

Plus I’m pretty sure my mom is committed to it. At least for now. It was a painless effort on her first shot. So thankfully she won’t think much about getting the 2nd.",2021-04-24 22:09:29
Comment,2,gvq8gnr,,0,1619284555.0,I’d be more worried about the person she sees trying to talk her out of getting the shot. Anti-vaxxism is a *huge* problem in the alt-health world.,2021-04-24 20:15:55
Comment,3,gvq7fp9,,0,1619284064.0,"Yeah the 2nd one. 

She always goes to see this person that puts magnets all over her body and finds convenient “viruses” to explain what is going on with her. 

I know it’s not real so I haven’t said much to her about it letting her go to it cause she’s convinced it makes her feel better. 

I’m just hoping that these magnets don’t do anything to the efficacy of the current vaccine she has, is all. I feel weird asking it but here we are lol.",2021-04-24 20:07:44
Comment,3,gvq5dfj,,0,1619283131.0,"Are you talking transcranial magnet stimulation, or the alternative medicine “magnet therapy” that the wellness influencers like to talk up? TMS is a legitimate medical therapy, and that’s a question for a doctor. Magnetic therapy is essentially a placebo at best, and should have the same chances of contraindication with a vaccination as homeopathic pills that are 99.99999999% water.",2021-04-24 19:52:11
Comment,1,gvazbzl,,0,1618996247.0,"Actually if you want to take your argument to its logical conclusion, you cant prove the world exists.  Maybe all the antivaxxers are trapped in some kind of Matrix nightmare.  Maybe you are the only sentient being in the universe and everything you experience is an illusion.  You cant prove it isnt so!",2021-04-21 12:10:47
Comment,1,gv5sqsy,,0,1618887573.0,"Chickenpox used to be almost universal among children before the chickenpox vaccine. So you probably had it when very young.  1 in 3 adults who had chickenpox can later get shingles, sometimes more than once.  No relation to MMR.",2021-04-20 05:59:33
Comment,2,gudpesi,,0,1618327802.0,"Luckily, my symptoms only lasted 1/2 day. I'm happy to feel a bit less anxiety around ppl.",2021-04-13 18:30:02
Comment,2,gudmocb,,0,1618326595.0," I felt similar things after my 2nd Pfizer vaccine. It all passed within a couple of days. This only means the vaccine is doing its job, and your immune system is preparing itself to handle the actual Covid pathogens.",2021-04-13 18:09:55
Comment,1,gu50r0o,,0,1618140702.0,Do you have any evidence that what he says is not barking mad?,2021-04-11 14:31:42
Comment,1,gts0g97,,0,1617859962.0,"you imply as if what he is saying is not true? 

why do you seek to misconstrue truth as false, so you can gain the accolades and applauses of the sheep?",2021-04-08 08:32:42
Comment,2,gtg52mq,,0,1617626781.0,"Thee can't doth the alternating caps thing.  T wast ov'r ere t did start

***



^(I am a bot and I swapp'd some of thy words with Shakespeare words.)

Commands: `!ShakespeareInsult`, `!fordo`, `!optout`",2021-04-05 15:46:21
Comment,1,gtg51sx,,0,1617626767.0,You can't do the alternating caps thing. It was over before it started,2021-04-05 15:46:07
Comment,3,gtf7kh5,,0,1617598303.0,"Was there, can confirm, it gets funnier too",2021-04-05 07:51:43
Comment,1,gt9bjtf,,0,1617467600.0,When I got my first covid shot I asked my nurse (I did warn her first I was totally joking) if my microchip would activate immediately after she injected it or if I had to do something afterwards. She laughed so hard. Glad I could make her laugh as she was having a busy and hectic day,2021-04-03 19:33:20
Comment,2,gt1egbq,,0,1617289974.0,YOU'RE,2021-04-01 18:12:54
Comment,3,gt0cxc2,,0,1617266329.0,Quality shitpost for this fine fine holiday.,2021-04-01 11:38:49
Comment,3,gt0cwa2,,0,1617266306.0,"I think you missed the joke here. By the way, what is the date?",2021-04-01 11:38:26
Comment,1,gt02b62,,0,1617256529.0, 🤦‍♂️🤦‍♂️,2021-04-01 08:55:29
Comment,0,gt0093o,,0,1617254879.0,You're an idiot.,2021-04-01 08:27:59
Comment,-2,gszopad,,0,1617247094.0,STOP LYING!,2021-04-01 06:18:14
Comment,-2,gszok2r,,0,1617247009.0,WHU AN I BEING DOWNCOTED!!!!!,2021-04-01 06:16:49
Comment,-6,gszoihv,,0,1617246982.0,YOUR PROBABLY PAID BY MULTIPLE PEOPLE TO SAY THIS!,2021-04-01 06:16:22
Comment,-4,gszo9fo,,0,1617246834.0,Shut the hell up! You know vaccines are bad!,2021-04-01 06:13:54
Comment,5,gszo33q,,0,1617246729.0,"This needs sources

EDIT: look at OP's userpage, this is a downvotes troll",2021-04-01 06:12:09
Comment,1,gsvanfl,,0,1617155003.0,"When someone mentions the microchips, I say the same thing. I go along with it and ask how do you know you only get one and not several?! Their reactions are priceless.",2021-03-31 04:43:23
Comment,1,gsva0qy,,0,1617154660.0,"Did she have Covid at some point prior to her vaccination? That can create a stronger reaction. 

Everyone reacts differently. My grandma was fine while my husband’s grandma had aches and dizziness.",2021-03-31 04:37:40
Comment,1,gsazbvq,,0,1616774534.0,"Best answer I can come  up with:  
Fever and body aches are symptoms from the innate immune system ramping up. 

But if your adaptive immune system (the kind of immunity you want from a vaccine) can take care of the antigens before they trigger an innate immune response, then those symptoms won't be as strong, if they're present at all.

Your immune system isn't *stronger,* *per se,* just you had already started developing the adaptive response and your sister relied more on an innate response. Two weeks after your second shots, you both should have comparable immunity to COVID. :)",2021-03-26 18:02:14
Comment,1,gs7wrsi,,0,1616706918.0,"*sigh*

Am I really gonna go pull all my immunology notes from school?  
Well, I might when I get home from work. ;P",2021-03-25 23:15:18
Comment,1,gs50ye7,,0,1616649627.0,This is a serious subject and antivaxxer replies are often so off the wall it is hard to separate them from parody.,2021-03-25 07:20:27
Comment,2,gs4m5rj,,0,1616640247.0,"I don't think scientists know the answer to that.

But I'd like to know. I got pretty tired, it would be nice to know it's because I'm super-protected :)",2021-03-25 04:44:07
Comment,1,gs48w9e,,0,1616633460.0,You honestly thought my reply was serious?,2021-03-25 02:51:00
Comment,1,gs3v2ut,,0,1616626766.0,"> Fever and chills means the immune system is making the antibodies for the COVID spike protein, so that’s not an issue at all.

Oh yeah? So if people don't have the chills and a fever **it must mean** their immune system is NOT making the supposed antibodies. Therefore, the people who died, or felt nothing means that the injection didn't work properly. 

> I got the second dose on Friday, was sick all of Saturday, and completely fine on Sunday. Get your head out of your ass.

Sounds very much like the girl who just died from the injection: 

[Ms. Penrod responded that she had her fingers crossed that March 10 would be the last day of her symptoms and it “goes away.” The next day she said she was feeling better “for the most part.” That was the last comment she made on Facebook. Ms. Penrod died on Wednesday, March 17, becoming the youngest victim this blog has covered for all of the experimental shots.](https://thecovidblog.com/2021/03/22/desiree-penrod-25-year-old-connecticut-educator-dead-one-week-after-johnson-johnson-viral-vector-shot/?__cf_chl_jschl_tk__=9edd43552370ae2990a4f3fab5013ee6851076f0-1616626641-0-ASifwr7C4GJTz0MkRFBIeRmRnsS58PVhw8eRRx9lK22ofAXbyR8wILt5cVGSYrNHJGENvOkGOSRMbIPbMVOfVbiLVoP9k_xOs31AVfhwD45uxkv1VzzsMonfhZWAjEBzWzjI-7_9aQnyjZCYTQ_TN-VXtUxaTnG9tjkNwkR-q2QTkB7NsW4ykAwqukYBKS87FHUQ0dBVS5Va0GUWi8vr-ACqw17dgD7nmljI-tEpAZL9uDGneAUg6z_gcjQ6Sggxqic1z81lVINghEqKUggHKKT5qhbhi0-KAVwcAUH1IRU35V6zlfm_Y5jMWSn0zesekAR6ocTi5OuorCLPb2ypm4eU3m2tCltQR-h1kIdNfvTLOe7I4BDNYER2BR0Ol_nws01W5r-RfSZChVLadIplXkr7k_nLn9wH2XtzxsmqTQRZ0VKxRj1SWF46cxu27cfeAUNddMAdUIgqyfzLIvmFu28)

Peace Out ;)",2021-03-25 00:59:26
Comment,1,gs3tsum,,0,1616626165.0,"Fever and chills means the immune system is making the antibodies for the COVID spike protein, so that’s not an issue at all. I got the second dose on Friday, was sick all of Saturday, and completely fine on Sunday. Get your head out of your ass.",2021-03-25 00:49:25
Comment,2,gs3t4jt,,0,1616625850.0,"You do know that every cell in our body has RNA, right? And it’s not exactly unknown",2021-03-25 00:44:10
Comment,1,gs3iy1k,,0,1616621173.0,The way to prevent viral mutation optimally would be to immunize everyone against it.  Viruses can only mutate when replicating in hosts.  With no hosts available cant mutate.,2021-03-24 23:26:13
Comment,1,gs3innr,,0,1616621044.0,"Please cite a serious reference that ""everyone has swole polio in their brains""?   Whatever ""swole polio"" may be. Everyone else sees that thanks to vaccines the rate of death or paralysis from polio has plummeted.",2021-03-24 23:24:04
Comment,1,gs3iadk,,0,1616620876.0,I think you will find most people these days who invent something in engineering or science have substantial education behind them.  Technology is a lot more complicated than in the days of Thomas Edison or Henry Ford,2021-03-24 23:21:16
Comment,1,gs3hsd4,,0,1616620646.0,"Also of course others OTF might even take you seriously. People have a responsibility to correct misinformation, particularly when that misinformation can kill.",2021-03-24 23:17:26
Comment,5,gs3c1iv,,0,1616618159.0,You keep using words but its clear you don't know what they mean.,2021-03-24 22:35:59
Comment,2,gs39vbp,,0,1616617236.0,Understandable. But Imma tell a you straight away. Viruses don't need that in order to mutate. Especially the covid kind. There's a reason why there is a new normal flu one every year.,2021-03-24 22:20:36
Comment,1,gs37erw,,0,1616616211.0,Because I would hope you'd be open minded and would actually change your mind when facts are presented to you.,2021-03-24 22:03:31
Comment,1,gs379np,,0,1616616151.0,"One last question! If you think it’s bullshit, why are you arguing with me? Why are you trying to prove me wrong?
If u think i’m an idiot why would you shrink to my level? As I can see you have a lot of time.",2021-03-24 22:02:31
Comment,1,gs365w2,,0,1616615699.0,"""Who is stupid to die for!""? You, I suppose, being pro-disease",2021-03-24 21:54:59
Comment,1,gs352ko,,0,1616615246.0,Aki hülye haljon bele!,2021-03-24 21:47:26
Comment,1,gs33ehk,,0,1616614546.0,Your own source proved you wrong. Sit down.,2021-03-24 21:35:46
